show_id,type,title,director,cast,country,date_added,release_year,rating,duration,listed_in,description,Poster_Link,Series_Title,Released_Year,Certificate,Runtime,Genre,IMDB_Rating,Overview,Meta_score,Director,Star1,Star2,Star3,Star4,No_of_Votes,Gross
s4307,Movie,roma,Alfonso Cuarón,"Yalitza Aparicio, Marina de Tavira","Mexico, United States","December 14, 2018",2018,R,135 min,"Dramas, Independent Movies, International Movies","Director Alfonso Cuarón delivers a vivid, emotional portrait of domestic life and social hierarchy set against Mexico's political turmoil of the 1970s.","https://m.media-amazon.com/images/M/MV5BMTU0OTc3ODk4Ml5BMl5BanBnXkFtZTgwMzM4NzI5NjM@._V1_UX67_CR0,0,67,98_AL_.jpg",roma,2018.0,R,135 min,Drama,7.7,A year in the life of a middle-class family's maid in Mexico City in the early 1970s.,96.0,Alfonso Cuarón,Yalitza Aparicio,Marina de Tavira,Diego Cortina Autrey,Carlos Peralta,140375,
s4427,Movie,barfi!,Anurag Basu,"Ranbir Kapoor, Priyanka Chopra, Ileana D'Cruz, Saurabh Shukla, Ashish Vidyarthi, Rupa Ganguly, Bholaraj Sapkota, Jishu Sengupta, Haradhan Bannerjee",India,"November 1, 2018",2012,TV-14,144 min,"Comedies, Dramas, International Movies","Years after rejecting Barfii, a hearing and speech impaired young man, for a more ""appropriate"" suitor, Shruti finds herself falling for him.","https://m.media-amazon.com/images/M/MV5BMTQzMTEyODY2Ml5BMl5BanBnXkFtZTgwMjA0MDUyMjE@._V1_UY98_CR0,0,67,98_AL_.jpg",barfi!,2012.0,U,151 min,"Comedy, Drama, Romance",8.1,Three young people learn that love can neither be defined nor contained by society's definition of normal and abnormal.,,Anurag Basu,Ranbir Kapoor,Priyanka Chopra,Ileana D'Cruz,Saurabh Shukla,75721,"2,804,874"
s4446,Movie,kai po che!,Abhishek Kapoor,"Rajkummar Rao, Amit Sadh, Sushant Singh Rajput, Amrita Puri, Digvijay Deshmukh, Asif Basra, Manav Kaul, Ashish Kakkad",India,"November 1, 2018",2013,TV-MA,120 min,"Dramas, International Movies, Sports Movies",This Bollywood drama tells the story of three best friends who dream of starting a cricket training academy in Ahmedabad for very different reasons.,"https://m.media-amazon.com/images/M/MV5BMTgwNTAwMjEzMF5BMl5BanBnXkFtZTcwNzMzODY4OA@@._V1_UY98_CR3,0,67,98_AL_.jpg",kai po che!,2013.0,U,130 min,"Drama, Sport",7.7,Three friends growing up in India at the turn of the millennium set out to open a training academy to produce the country's next cricket stars.,40.0,Abhishek Kapoor,Amit Sadh,Sushant Singh Rajput,Rajkummar Rao,Amrita Puri,32628,"1,122,527"
s4563,Movie,dev.d,Anurag Kashyap,"Abhay Deol, Mahie Gill, Kalki Koechlin, Sindbad Phgura, Ammo 'Too Sweet', Jimi the Quiff, Parakh Madan",India,"October 1, 2018",2009,TV-MA,137 min,"Dramas, International Movies, Romantic Movies","Because they come from different castes, the son of a tax collector and his true love are not allowed to marry, sending them down divergent paths.","https://m.media-amazon.com/images/M/MV5BYjU1NjczNzYtYmFjOC00NzkxLTg4YTUtNGYzMTk3NTU0ZDE3XkEyXkFqcGdeQXVyNDUzOTQ5MjY@._V1_UY98_CR0,0,67,98_AL_.jpg",dev.d,2009.0,A,144 min,"Drama, Romance",8.0,"After breaking up with his childhood sweetheart, a young man finds solace in drugs. Meanwhile, a teenage girl is caught in the world of prostitution. Will they be destroyed, or will they find redemption?",,Anurag Kashyap,Abhay Deol,Mahie Gill,Kalki Koechlin,Dibyendu Bhattacharya,28749,"10,950"
s4611,Movie,udaan,Vikramaditya Motwane,"Rajat Barmecha, Ronit Roy, Ram Kapoor, Aayan Boradia, Manjot Singh, Anand Tiwari, Raja Hudda, Shaunak Sengupta, Varun Khettry, Akshay Sachdev",India,"October 1, 2018",2010,TV-MA,137 min,"Dramas, Independent Movies, International Movies","Upon returning to his industrial hometown, a young man must decide whether to follow his own dreams or acquiesce to his father's plans for his future.","https://m.media-amazon.com/images/M/MV5BNzgxMzExMzUwNV5BMl5BanBnXkFtZTcwMDc2MjUwNA@@._V1_UY98_CR0,0,67,98_AL_.jpg",udaan,2010.0,UA,134 min,Drama,8.2,"Expelled from his school, a 16-year old boy returns home to his abusive and oppressive father.",,Vikramaditya Motwane,Rajat Barmecha,Ronit Roy,Manjot Singh,Ram Kapoor,42341,"7,461"
s4661,Movie,pk,Rajkumar Hirani,"Aamir Khan, Anuskha Sharma, Sanjay Dutt, Saurabh Shukla, Parikshat Sahni, Sushant Singh Rajput, Boman Irani, Rukhsar",India,"September 6, 2018",2014,TV-14,146 min,"Comedies, Dramas, International Movies",Aamir Khan teams with director Rajkumar Hirani to play a social crusader in a political satire on the state of corruption in India.,"https://m.media-amazon.com/images/M/MV5BMTYzOTE2NjkxN15BMl5BanBnXkFtZTgwMDgzMTg0MzE@._V1_UY98_CR0,0,67,98_AL_.jpg",pk,2014.0,UA,153 min,"Comedy, Drama, Musical",8.1,An alien on Earth loses the only device he can use to communicate with his spaceship. His innocent nature and child-like questions force the country to evaluate the impact of religion on its people.,,Rajkumar Hirani,Aamir Khan,Anushka Sharma,Sanjay Dutt,Boman Irani,163061,"10,616,104"
s4726,Movie,haider,Vishal Bhardwaj,"Shahid Kapoor, Tabu, Shraddha Kapoor, Kay Kay Menon, Irrfan Khan, Narendra Jha",India,"August 2, 2018",2014,TV-MA,154 min,"Dramas, International Movies, Romantic Movies",Shahid Kapoor delivers a searing performance in this Bollywood take on Hamlet that unfolds amid Kashmiri culture and history.,"https://m.media-amazon.com/images/M/MV5BMjA1NTEwMDMxMF5BMl5BanBnXkFtZTgwODkzMzI0MjE@._V1_UY98_CR0,0,67,98_AL_.jpg",haider,2014.0,UA,160 min,"Action, Crime, Drama",8.1,"A young man returns to Kashmir after his father's disappearance to confront his uncle, whom he suspects of playing a role in his father's fate.",,Vishal Bhardwaj,Shahid Kapoor,Tabu,Shraddha Kapoor,Kay Kay Menon,50445,"901,610"
s4733,Movie,rang de basanti,Rakeysh Omprakash Mehra,"Aamir Khan, Siddharth, Atul Kulkarni, Sharman Joshi, Kunal Kapoor, Alice Patten, Soha Ali Khan, Waheeda Rehman, Kiron Kher, Om Puri, Anupam Kher, Madhavan",India,"August 2, 2018",2006,TV-14,159 min,"Dramas, International Movies",An idealistic English filmmaker casts a group of student actors in her docudrama about India's revolution against British rule in the 1920s.,"https://m.media-amazon.com/images/M/MV5BYThmZDA0YmQtMWJhNy00MDQwLTk0Y2YtMDhmZTE5ZjhlNjliXkEyXkFqcGdeQXVyODE5NzE3OTE@._V1_UY98_CR1,0,67,98_AL_.jpg",rang de basanti,2006.0,UA,167 min,"Comedy, Crime, Drama",8.2,"The story of six young Indians who assist an English woman to film a documentary on the freedom fighters from their past, and the events that lead them to relive the long-forgotten saga of freedom.",,Rakeysh Omprakash Mehra,Aamir Khan,Soha Ali Khan,Siddharth,Sharman Joshi,111937,"2,197,331"
s5204,Movie,the hateful eight,Quentin Tarantino,"Samuel L. Jackson, Kurt Russell, Jennifer Jason Leigh, Walton Goggins, Demián Bichir, Tim Roth, Michael Madsen, Bruce Dern, James Parks, Dana Gourrier, Channing Tatum, Zoë Bell",United States,"October 25, 2017",2015,R,168 min,"Action & Adventure, Thrillers","Years after the Civil War, a bounty hunter and his captive are waylaid by a Wyoming blizzard and hole up in a way station with six dicey strangers.","https://m.media-amazon.com/images/M/MV5BMjA1MTc1NTg5NV5BMl5BanBnXkFtZTgwOTM2MDEzNzE@._V1_UX67_CR0,0,67,98_AL_.jpg",the hateful eight,2015.0,A,168 min,"Crime, Drama, Mystery",7.8,"In the dead of a Wyoming winter, a bounty hunter and his prisoner find shelter in a cabin currently inhabited by a collection of nefarious characters.",68.0,Quentin Tarantino,Samuel L. Jackson,Kurt Russell,Jennifer Jason Leigh,Walton Goggins,517059,"54,117,416"
s5421,Movie,dangal,Nitesh Tiwari,"Aamir Khan, Sakshi Tanwar, Fatima Sana Shaikh, Sanya Malhotra, Aparshakti Khurana, Zaira Wasim, Suhani Bhatnagar, Ritwik Sahore",India,"June 21, 2017",2016,TV-PG,161 min,"Dramas, International Movies, Sports Movies",A once-promising wrestler pursues the gold medal he never won by training two of his daughters to compete at the Commonwealth Games.,"https://m.media-amazon.com/images/M/MV5BMTQ4MzQzMzM2Nl5BMl5BanBnXkFtZTgwMTQ1NzU3MDI@._V1_UY98_CR1,0,67,98_AL_.jpg",dangal,2016.0,U,161 min,"Action, Biography, Drama",8.4,Former wrestler Mahavir Singh Phogat and his two wrestler daughters struggle towards glory at the Commonwealth Games in the face of societal oppression.,,Nitesh Tiwari,Aamir Khan,Sakshi Tanwar,Fatima Sana Shaikh,Sanya Malhotra,156479,"12,391,761"
s5630,Movie,pink,Aniruddha Roy Chowdhury,"Tapsee Pannu, Kirti Kulhari, Andrea Tariang, Amitabh Bachchan, Piyush Mishra, Angad Bedi, Vijay Varma, Raashul Tandon, Tushar Pandey, Dhritiman Chatterjee, Mamata Shankar",India,"January 20, 2017",2016,TV-14,130 min,"Dramas, International Movies","A sexual assault victim, unjustly tried for the attempted murder of her attacker, is defended by a retired lawyer who challenges India's rape culture.","https://m.media-amazon.com/images/M/MV5BNGI1MTI1YTQtY2QwYi00YzUzLTg3NWYtNzExZDlhOTZmZWU0XkEyXkFqcGdeQXVyMDkwNTkwNg@@._V1_UY98_CR3,0,67,98_AL_.jpg",pink,2016.0,UA,136 min,"Drama, Thriller",8.1,"When three young women are implicated in a crime, a retired lawyer steps forward to help them clear their names.",,Aniruddha Roy Chowdhury,Taapsee Pannu,Amitabh Bachchan,Kirti Kulhari,Andrea Tariang,39216,"1,241,223"
s5652,Movie,udta punjab,Abhishek Chaubey,"Shahid Kapoor, Kareena Kapoor, Alia Bhatt, Diljit Dosanjh, Satish Kaushik, Suhail Nayyar, Prabhjyot Singh, Harpreet Singh, Manav Vij, Taran Bajaj",India,"January 1, 2017",2016,TV-MA,146 min,"Dramas, International Movies","Drug abuse and the darker side of Punjab rear their heads in the intense, interwoven tales of a cop, a doctor, a migrant worker and a rock star.","https://m.media-amazon.com/images/M/MV5BY2YxNjQxYWYtYzNkMi00YTgyLWIwZTMtYzgyYjZlZmYzZTA0XkEyXkFqcGdeQXVyMTA4NjE0NjEy._V1_UX67_CR0,0,67,98_AL_.jpg",udta punjab,2016.0,A,148 min,"Action, Crime, Drama",7.8,A story that revolves around drug abuse in the affluent north Indian State of Punjab and how the youth there have succumbed to it en-masse resulting in a socio-economic decline.,,Abhishek Chaubey,Shahid Kapoor,Alia Bhatt,Kareena Kapoor,Diljit Dosanjh,27175,
s5892,Movie,beasts of no nation,Cary Joji Fukunaga,"Idris Elba, Abraham Attah, Kurt Egyiawan, Jude Akuwudike, Emmanuel ""King Kong"" Nii Adom Quaye, Ama K. Abebrese, Kobina Amissah Sam, Francis Weddey, Richard Pepple",United States,"October 16, 2015",2015,TV-MA,137 min,"Dramas, Independent Movies","When civil war tears his family apart, a young West African boy is forced to join a unit of mercenary fighters and transform into a child soldier.","https://m.media-amazon.com/images/M/MV5BMTYwMzMzMDI0NF5BMl5BanBnXkFtZTgwNDQ3NjI3NjE@._V1_UX67_CR0,0,67,98_AL_.jpg",beasts of no nation,2015.0,,137 min,"Drama, War",7.7,"A drama based on the experiences of Agu, a child soldier fighting in the civil war of an unnamed African country.",79.0,Cary Joji Fukunaga,Abraham Attah,Emmanuel Affadzi,Ricky Adelayitor,Andrew Adote,73964,"83,861"
s6020,Movie,50/50,Jonathan Levine,"Joseph Gordon-Levitt, Seth Rogen, Anna Kendrick, Bryce Dallas Howard, Anjelica Huston, Serge Houde, Andrew Airlie, Matt Frewer, Philip Baker Hall, Marie Avgeropoulos, Jessica Parker Kennedy",United States,"June 1, 2019",2011,R,100 min,"Comedies, Dramas, Independent Movies",An otherwise healthy twentysomething has a comically early midlife crisis when he gets slapped with a cancer diagnosis and a 50-50 chance of survival.,"https://m.media-amazon.com/images/M/MV5BNjg3ODQyNTIyN15BMl5BanBnXkFtZTcwMjUzNzM5NQ@@._V1_UX67_CR0,0,67,98_AL_.jpg",50/50,2011.0,R,100 min,"Comedy, Drama, Romance",7.6,"Inspired by a true story, a comedy centered on a 27-year-old guy who learns of his cancer diagnosis and his subsequent struggle to beat the disease.",72.0,Jonathan Levine,Joseph Gordon-Levitt,Seth Rogen,Anna Kendrick,Bryce Dallas Howard,315426,"35,014,192"
s6032,Movie,a clockwork orange,Stanley Kubrick,"Malcolm McDowell, Patrick Magee, Michael Bates, Warren Clarke, Adrienne Corri, Paul Farrell, Miriam Karlin, James Marcus","United Kingdom, United States","November 1, 2020",1971,R,137 min,"Classic Movies, Cult Movies, Dramas","In this dark satire from director Stanley Kubrick, a young, vicious sociopath in a dystopian England undergoes an experimental rehabilitation therapy.","https://m.media-amazon.com/images/M/MV5BMTY3MjM1Mzc4N15BMl5BanBnXkFtZTgwODM0NzAxMDE@._V1_UX67_CR0,0,67,98_AL_.jpg",a clockwork orange,1971.0,A,136 min,"Crime, Drama, Sci-Fi",8.3,"In the future, a sadistic gang leader is imprisoned and volunteers for a conduct-aversion experiment, but it doesn't go as planned.",77.0,Stanley Kubrick,Malcolm McDowell,Patrick Magee,Michael Bates,Warren Clarke,757904,"6,207,725"
s6064,Movie,a wednesday,Neeraj Pandey,"Anupam Kher, Naseeruddin Shah, Jimmy Shergill, Deepal Shaw, Aamir Bashir, Kali Prasad Mukherjee, Vijay Bhatia, Chetan Pandit",India,"November 1, 2018",2008,TV-MA,103 min,"Action & Adventure, Dramas, International Movies","After receiving an anonymous tip about a bomb, a police commissioner must negotiate with the terrorist, who demands the release of four militants.","https://m.media-amazon.com/images/M/MV5BOTcwMzdiMWItMjZlOS00MzAzLTg5OTItNTA4OGYyMjBhMmRiXkEyXkFqcGdeQXVyODE5NzE3OTE@._V1_UY98_CR1,0,67,98_AL_.jpg",a wednesday,2008.0,UA,104 min,"Action, Crime, Drama",8.1,A retiring police officer reminisces about the most astounding day of his career. About a case that was never filed but continues to haunt him in his memories - the case of a man and a Wednesday.,,Neeraj Pandey,Anupam Kher,Naseeruddin Shah,Jimmy Sheirgill,Aamir Bashir,73891,
s6136,Movie,american beauty,Sam Mendes,"Kevin Spacey, Annette Bening, Thora Birch, Wes Bentley, Mena Suvari, Chris Cooper, Peter Gallagher, Allison Janney, Scott Bakula, Sam Robards",United States,"January 1, 2020",1999,R,122 min,Dramas,"While struggling to endure his tightly wound wife, an unfulfilling job and a surly teen, a man becomes obsessed with one of his daughter's friends.","https://m.media-amazon.com/images/M/MV5BNTBmZWJkNjctNDhiNC00MGE2LWEwOTctZTk5OGVhMWMyNmVhXkEyXkFqcGdeQXVyMTMxODk2OTU@._V1_UX67_CR0,0,67,98_AL_.jpg",american beauty,1999.0,UA,122 min,Drama,8.3,A sexually frustrated suburban father has a mid-life crisis after becoming infatuated with his daughter's best friend.,84.0,Sam Mendes,Kevin Spacey,Annette Bening,Thora Birch,Wes Bentley,1069738,"130,096,601"
s6144,Movie,american history x,Tony Kaye,"Edward Norton, Edward Furlong, Beverly D'Angelo, Jennifer Lien, Ethan Suplee, Fairuza Balk, Avery Brooks, Elliott Gould, Stacy Keach, William Russ, Guy Torry",United States,"November 1, 2019",1998,R,119 min,Dramas,A neo-Nazi gets sent to prison for murder and comes out a changed man. But can he prevent his younger brother from following in his footsteps?,"https://m.media-amazon.com/images/M/MV5BZjA0MTM4MTQtNzY5MC00NzY3LWI1ZTgtYzcxMjkyMzU4MDZiXkEyXkFqcGdeQXVyNDYyMDk5MTU@._V1_UX67_CR0,0,67,98_AL_.jpg",american history x,1998.0,R,119 min,Drama,8.5,A former neo-nazi skinhead tries to prevent his younger brother from going down the same wrong path that he did.,62.0,Tony Kaye,Edward Norton,Edward Furlong,Beverly D'Angelo,Jennifer Lien,1034705,"6,719,864"
s6148,Movie,american psycho,Mary Harron,"Christian Bale, Willem Dafoe, Jared Leto, Reese Witherspoon, Samantha Mathis, Chloë Sevigny, Justin Theroux, Josh Lucas, Matt Ross, Bill Sage, Cara Seymour, Guinevere Turner","United States, Canada","September 1, 2019",2000,R,102 min,"Comedies, Cult Movies, Dramas","With chiseled good looks that belie his insanity, a businessman takes pathological pride in yuppie pursuits and indulges in sudden homicidal urges.","https://m.media-amazon.com/images/M/MV5BZTM2ZGJmNjQtN2UyOS00NjcxLWFjMDktMDE2NzMyNTZlZTBiXkEyXkFqcGdeQXVyNzkwMjQ5NzM@._V1_UX67_CR0,0,67,98_AL_.jpg",american psycho,2000.0,A,101 min,"Comedy, Crime, Drama",7.6,"A wealthy New York City investment banking executive, Patrick Bateman, hides his alternate psychopathic ego from his co-workers and friends as he delves deeper into his violent, hedonistic fantasies.",64.0,Mary Harron,Christian Bale,Justin Theroux,Josh Lucas,Bill Sage,490062,"15,070,285"
s6189,Movie,as good as it gets,James L. Brooks,"Jack Nicholson, Helen Hunt, Greg Kinnear, Cuba Gooding Jr., Skeet Ulrich, Shirley Knight, Yeardley Smith, Lupe Ontiveros",United States,"January 1, 2020",1997,PG-13,139 min,"Comedies, Romantic Movies","The structured world of a sour, obsessive-compulsive author crumbles when he's drawn into the lives of a stressed-out single mom and his gay neighbor.","https://m.media-amazon.com/images/M/MV5BNWMxZTgzMWEtMTU0Zi00NDc5LWFkZjctMzUxNDIyNzZiMmNjXkEyXkFqcGdeQXVyMTQxNzMzNDI@._V1_UX67_CR0,0,67,98_AL_.jpg",as good as it gets,1997.0,A,139 min,"Comedy, Drama, Romance",7.7,"A single mother and waitress, a misanthropic author, and a gay artist form an unlikely friendship after the artist is assaulted in a robbery.",67.0,James L. Brooks,Jack Nicholson,Helen Hunt,Greg Kinnear,Cuba Gooding Jr.,275755,"148,478,011"
s6201,Movie,avengers: infinity war,"Anthony Russo, Joe Russo","Robert Downey Jr., Josh Brolin, Mark Ruffalo, Tom Hiddleston, Chris Evans, Chris Hemsworth, Jeremy Renner, Chris Pratt, Elizabeth Olsen, Sebastian Stan, Benedict Cumberbatch, Paul Bettany, Cobie Smulders, Benedict Wong, Zoe Saldana, Karen Gillan, Vin Diesel, Dave Bautista, Bradley Cooper, Pom Klementieff, Scarlett Johansson, Benicio Del Toro, Anthony Mackie, Chadwick Boseman, Danai Gurira, Paul Rudd, Don Cheadle, Tom Holland",United States,"December 25, 2018",2018,PG-13,150 min,"Action & Adventure, Sci-Fi & Fantasy",Superheroes amass to stop intergalactic sociopath Thanos from acquiring a full set of Infinity Stones and wiping out half of all life in the universe.,"https://m.media-amazon.com/images/M/MV5BMjMxNjY2MDU1OV5BMl5BanBnXkFtZTgwNzY1MTUwNTM@._V1_UX67_CR0,0,67,98_AL_.jpg",avengers: infinity war,2018.0,UA,149 min,"Action, Adventure, Sci-Fi",8.4,The Avengers and their allies must be willing to sacrifice all in an attempt to defeat the powerful Thanos before his blitz of devastation and ruin puts an end to the universe.,68.0,Anthony Russo,Joe Russo,Robert Downey Jr.,Chris Hemsworth,Mark Ruffalo,834477,"678,815,482"
s6312,Movie,billy elliot,Stephen Daldry,"Jamie Bell, Gary Lewis, Stuart Wells, Billy Fane, Colin MacLachlan, Nicola Blackwell, Carol McGuigan, Joe Renton, Janine Birkett, Charlie Hardwick, Mike Elliot, Jean Heywood, Jamie Draven, Julie Walters, Trevor Fox, Adam Cooper","United Kingdom, France","February 1, 2019",2000,R,110 min,"Dramas, Independent Movies, International Movies","When a boy trades boxing school for ballet lessons, he may take his newfound talent all the way to the top - and win over his disapproving father.","https://m.media-amazon.com/images/M/MV5BNGY3NWYwNzctNWU5Yi00ZjljLTgyNDgtZjNhZjRlNjc0ZTU1XkEyXkFqcGdeQXVyMTQxNzMzNDI@._V1_UX67_CR0,0,67,98_AL_.jpg",billy elliot,2000.0,R,110 min,"Drama, Music",7.7,A talented young boy becomes torn between his unexpected love of dance and the disintegration of his family.,74.0,Stephen Daldry,Jamie Bell,Julie Walters,Jean Heywood,Jamie Draven,126770,"21,995,263"
s6323,Movie,black hawk down,Ridley Scott,"Josh Hartnett, Ewan McGregor, Tom Sizemore, Eric Bana, William Fichtner, Ewen Bremner, Sam Shepard, Gabriel Casseus, Kim Coates, Hugh Dancy, Ron Eldard, Ioan Gruffudd, Tom Guiry, Charlie Hofheimer, Danny Hoch, Jason Isaacs, Zeljko Ivanek, Glenn Morshower, Jeremy Piven, Brendan Sexton III","United States, United Kingdom","January 1, 2019",2001,R,144 min,"Action & Adventure, Dramas","When U.S. forces attempt to capture two underlings of a Somali warlord, their helicopters are shot down and the Americans suffer heavy casualties.","https://m.media-amazon.com/images/M/MV5BYWMwMzQxZjQtODM1YS00YmFiLTk1YjQtNzNiYWY1MDE4NTdiXkEyXkFqcGdeQXVyNDYyMDk5MTU@._V1_UX67_CR0,0,67,98_AL_.jpg",black hawk down,2001.0,A,144 min,"Drama, History, War",7.7,160 elite U.S. soldiers drop into Somalia to capture two top lieutenants of a renegade warlord and find themselves in a desperate battle with a large force of heavily-armed Somalis.,74.0,Ridley Scott,Josh Hartnett,Ewan McGregor,Tom Sizemore,Eric Bana,364254,"108,638,745"
s6338,Movie,blow,Ted Demme,"Johnny Depp, Penélope Cruz, Franka Potente, Rachel Griffiths, Paul Reubens, Jordi Mollà, Cliff Curtis, Miguel Sandoval, Ethan Suplee, Ray Liotta",United States,"October 1, 2019",2001,R,123 min,Dramas,Cocaine smuggler George rises from poverty to become one of the biggest drug dealers in America before his eventual downfall.,"https://m.media-amazon.com/images/M/MV5BYjg5ZDkzZWEtZDQ2ZC00Y2ViLThhMzYtMmIxZDYzYTY2Y2Y2XkEyXkFqcGdeQXVyODAwMTU1MTE@._V1_UY98_CR1,0,67,98_AL_.jpg",blow,2001.0,R,124 min,"Biography, Crime, Drama",7.6,"The story of how George Jung, along with the Medellín Cartel headed by Pablo Escobar, established the American cocaine market in the 1970s in the United States.",52.0,Ted Demme,Johnny Depp,Penélope Cruz,Franka Potente,Rachel Griffiths,240714,"52,990,775"
s6359,Movie,bonnie and clyde,Arthur Penn,"Warren Beatty, Faye Dunaway, Michael J. Pollard, Gene Hackman, Estelle Parsons, Denver Pyle, Dub Taylor, Evans Evans, Gene Wilder",United States,"January 1, 2021",1967,R,111 min,"Action & Adventure, Classic Movies, Dramas","Bonnie Parker and Clyde Barrow are young, in love and on the run during a bullet-riddled bank robbery spree across Depression-ravaged America.","https://m.media-amazon.com/images/M/MV5BOTViZmMwOGEtYzc4Yy00ZGQ1LWFkZDQtMDljNGZlMjAxMjhiXkEyXkFqcGdeQXVyNzM0MTUwNTY@._V1_UX67_CR0,0,67,98_AL_.jpg",bonnie and clyde,1967.0,A,111 min,"Action, Biography, Crime",7.8,"Bored waitress Bonnie Parker falls in love with an ex-con named Clyde Barrow and together they start a violent crime spree through the country, stealing cars and robbing banks.",86.0,Arthur Penn,Warren Beatty,Faye Dunaway,Michael J. Pollard,Gene Hackman,102415,
s6428,Movie,casino royale,Martin Campbell,"Daniel Craig, Judi Dench, Eva Green, Jeffrey Wright, Mads Mikkelsen, Giancarlo Giannini","United Kingdom, Czech Republic, United States, Germany, Bahamas","August 31, 2020",2006,PG-13,145 min,Action & Adventure,"Daniel Craig makes his debut as the newly minted agent 007, who's pitted against an infamous financier of global terrorism – at the poker table.","https://m.media-amazon.com/images/M/MV5BMDI5ZWJhOWItYTlhOC00YWNhLTlkNzctNDU5YTI1M2E1MWZhXkEyXkFqcGdeQXVyNTIzOTk5ODM@._V1_UX67_CR0,0,67,98_AL_.jpg",casino royale,2006.0,PG-13,144 min,"Action, Adventure, Thriller",8.0,"After earning 00 status and a licence to kill, Secret Agent James Bond sets out on his first mission as 007. Bond must defeat a private banker funding terrorists in a high-stakes game of poker at Casino Royale, Montenegro.",80.0,Martin Campbell,Daniel Craig,Eva Green,Judi Dench,Jeffrey Wright,582239,"167,445,960"
s6432,Movie,cat on a hot tin roof,Richard Brooks,"Elizabeth Taylor, Paul Newman, Burl Ives, Jack Carson, Judith Anderson, Madeleine Sherwood, Larry Gates, Vaughn Taylor",United States,"November 1, 2019",1958,NR,108 min,"Classic Movies, Dramas","Members of a Southern clan scramble to curry favor with a dying, wealthy patriarch in this adaptation of Tennessee Williams's sizzling stage drama.","https://m.media-amazon.com/images/M/MV5BMzFhNTMwNDMtZjY3Yy00NzY3LWI1ZWQtZTQxMWJmODVhZWFkXkEyXkFqcGdeQXVyNjQzNDI3NzY@._V1_UX67_CR0,0,67,98_AL_.jpg",cat on a hot tin roof,1958.0,A,108 min,Drama,8.0,Brick is an alcoholic ex-football player who drinks his days away and resists the affections of his wife. A reunion with his terminal father jogs a host of memories and revelations for both father and son.,84.0,Richard Brooks,Elizabeth Taylor,Paul Newman,Burl Ives,Jack Carson,45062,"17,570,324"
s6534,Movie,cool hand luke,Stuart Rosenberg,"Paul Newman, George Kennedy, J.D. Cannon, Lou Antonio, Robert Drivas, Strother Martin, Jo Van Fleet, Harry Dean Stanton, Dennis Hopper, Joe Don Baker, James Gammon, Wayne Rogers",United States,"January 1, 2021",1967,TV-14,127 min,"Classic Movies, Dramas","Luke Jackson likes to do things his own way, which leads to a world of hurt when he ends up in a prison camp – and on the wrong side of its warden.","https://m.media-amazon.com/images/M/MV5BOWFlNzZhYmYtYTI5YS00MDQyLWIyNTUtNTRjMWUwNTEzNjA0XkEyXkFqcGdeQXVyNjUwNzk3NDc@._V1_UX67_CR0,0,67,98_AL_.jpg",cool hand luke,1967.0,A,127 min,"Crime, Drama",8.1,"A laid back Southern man is sentenced to two years in a rural prison, but refuses to conform.",92.0,Stuart Rosenberg,Paul Newman,George Kennedy,Strother Martin,J.D. Cannon,161984,"16,217,773"
s6537,Movie,coraline,Henry Selick,"Dakota Fanning, Teri Hatcher, John Hodgman, Jennifer Saunders, Dawn French, Keith David, Robert Bailey Jr., Ian McShane",United States,"March 16, 2017",2009,PG,101 min,Children & Family Movies,Curious young Coraline unlocks a door in her family's home and is transported to a universe that strangely resembles her own – only better.,"https://m.media-amazon.com/images/M/MV5BMzQxNjM5NzkxNV5BMl5BanBnXkFtZTcwMzg5NDMwMg@@._V1_UX67_CR0,0,67,98_AL_.jpg",coraline,2009.0,U,100 min,"Animation, Drama, Family",7.7,"An adventurous 11-year-old girl finds another world that is a strangely idealized version of her frustrating home, but it has sinister secrets.",80.0,Henry Selick,Dakota Fanning,Teri Hatcher,John Hodgman,Jennifer Saunders,197761,"75,286,229"
