show_id,type,title,director,cast,country,date_added,release_year,rating,duration,listed_in,description,Poster_Link,Series_Title,Released_Year,Certificate,Runtime,Genre,IMDB_Rating,Overview,Meta_score,Director,Star1,Star2,Star3,Star4,No_of_Votes,Gross
s7880,Movie,rocky,John G. Avildsen,"Sylvester Stallone, Talia Shire, Burt Young, Carl Weathers, Burgess Meredith, Thayer David, Joe Spinell, Jimmy Gambina, Bill Baldwin",United States,"August 1, 2019",1976,PG,120 min,"Action & Adventure, Classic Movies, Dramas","Sylvester Stallone shot to fame as Rocky Balboa, an unknown fighter who's given a shot at fighting world champ Apollo Creed as a publicity stunt.","https://m.media-amazon.com/images/M/MV5BMTY5MDMzODUyOF5BMl5BanBnXkFtZTcwMTQ3NTMyNA@@._V1_UX67_CR0,0,67,98_AL_.jpg",rocky,1976.0,U,120 min,"Drama, Sport",8.1,A small-time boxer gets a supremely rare chance to fight a heavy-weight champion in a bout in which he strives to go the distance for his self-respect.,70.0,John G. Avildsen,Sylvester Stallone,Talia Shire,Burt Young,Carl Weathers,518546,"117,235,247"
s7890,Movie,room,Lenny Abrahamson,"Brie Larson, Jacob Tremblay, Joan Allen, Sean Bridgers, Tom McCamus, William H. Macy, Cas Anvar, Amanda Brugel, Wendy Crewson, Sandy McMaster","Ireland, Canada, United Kingdom, United States","July 19, 2018",2015,R,118 min,"Dramas, Independent Movies","Kidnapped, confined to a tiny room and raped, a young woman gives birth to a son. When he reaches his fifth birthday, she begins plotting an escape.","https://m.media-amazon.com/images/M/MV5BMjE4NzgzNzEwMl5BMl5BanBnXkFtZTgwMTMzMDE0NjE@._V1_UX67_CR0,0,67,98_AL_.jpg",room,2015.0,R,118 min,"Drama, Thriller",8.1,"Held captive for 7 years in an enclosed space, a woman and her young son finally gain their freedom, allowing the boy to experience the outside world for the first time.",86.0,Lenny Abrahamson,Brie Larson,Jacob Tremblay,Sean Bridgers,Wendy Crewson,371538,"14,677,674"
s7895,Movie,rosemary's baby,Roman Polanski,"Mia Farrow, John Cassavetes, Ruth Gordon, Sidney Blackmer, Maurice Evans, Ralph Bellamy, Patsy Kelly, Elisha Cook Jr., Emmaline Henry, Charles Grodin",United States,"November 1, 2019",1968,R,137 min,"Classic Movies, Horror Movies, Thrillers","A woman is thrilled to find out she's pregnant. But as her belly grows, the more certain she becomes that her unborn child is in serious danger.","https://m.media-amazon.com/images/M/MV5BZmEwZGU2NzctYzlmNi00MGJkLWE3N2MtYjBlN2ZhMGJkZTZiXkEyXkFqcGdeQXVyMTQxNzMzNDI@._V1_UX67_CR0,0,67,98_AL_.jpg",rosemary's baby,1968.0,A,137 min,"Drama, Horror",8.0,A young couple trying for a baby move into a fancy apartment surrounded by peculiar neighbors.,96.0,Roman Polanski,Mia Farrow,John Cassavetes,Ruth Gordon,Sidney Blackmer,193674,
s7958,Movie,schindler's list,Steven Spielberg,"Liam Neeson, Ben Kingsley, Ralph Fiennes, Caroline Goodall, Jonathan Sagall, Embeth Davidtz, Małgorzata Gebel, Shmulik Levy, Mark Ivanir, Beatrice Macola, Friedrich von Thun, Andrzej Seweryn",United States,"April 1, 2018",1993,R,195 min,"Classic Movies, Dramas","Oskar Schindler becomes an unlikely humanitarian, spending his entire fortune to help save 1,100 Jews from Auschwitz during World War II.","https://m.media-amazon.com/images/M/MV5BNDE4OTMxMTctNmRhYy00NWE2LTg3YzItYTk3M2UwOTU5Njg4XkEyXkFqcGdeQXVyNjU0OTQ0OTY@._V1_UX67_CR0,0,67,98_AL_.jpg",schindler's list,1993.0,A,195 min,"Biography, Drama, History",8.9,"In German-occupied Poland during World War II, industrialist Oskar Schindler gradually becomes concerned for his Jewish workforce after witnessing their persecution by the Nazis.",94.0,Steven Spielberg,Liam Neeson,Ralph Fiennes,Ben Kingsley,Caroline Goodall,1213505,"96,898,818"
s8004,Movie,sherlock holmes,Guy Ritchie,"Robert Downey Jr., Jude Law, Rachel McAdams, Mark Strong, Eddie Marsan, Robert Maillet, Geraldine James, Kelly Reilly, William Houston, James Fox, Hans Matheson","United States, Germany, United Kingdom, Australia","January 1, 2021",2009,PG-13,128 min,"Action & Adventure, Comedies",The game is afoot for an eccentric detective who must use his brains and brawn to track down a nefarious nemesis with the help of his partner.,"https://m.media-amazon.com/images/M/MV5BMTg0NjEwNjUxM15BMl5BanBnXkFtZTcwMzk0MjQ5Mg@@._V1_UX67_CR0,0,67,98_AL_.jpg",sherlock holmes,2009.0,PG-13,128 min,"Action, Adventure, Mystery",7.6,Detective Sherlock Holmes and his stalwart partner Watson engage in a battle of wits and brawn with a nemesis whose plot is a threat to all of England.,57.0,Guy Ritchie,Robert Downey Jr.,Jude Law,Rachel McAdams,Mark Strong,583158,"209,028,679"
s8010,Movie,short term 12,Destin Daniel Cretton,"Brie Larson, John Gallagher Jr., Kaitlyn Dever, Rami Malek, Lakeith Stanfield, Kevin Hernandez, Melora Walters, Stephanie Beatriz, Lydia Du Veaux, Alex Calloway, Frantz Turner",United States,"July 18, 2019",2013,R,97 min,"Dramas, Independent Movies","A new charge at a foster care facility dredges up the memories of a young supervisor's own troubled past, and her tough exterior begins eroding.","https://m.media-amazon.com/images/M/MV5BMTEwNjE2OTM4NDZeQTJeQWpwZ15BbWU3MDE2MTE4OTk@._V1_UX67_CR0,0,67,98_AL_.jpg",short term 12,2013.0,R,96 min,Drama,8.0,A 20-something supervising staff member of a residential treatment facility navigates the troubled waters of that world alongside her co-worker and longtime boyfriend.,82.0,Destin Daniel Cretton,Brie Larson,Frantz Turner,John Gallagher Jr.,Kaitlyn Dever,81770,"1,010,414"
s8039,Movie,sling blade,Billy Bob Thornton,"Billy Bob Thornton, Dwight Yoakam, J.T. Walsh, John Ritter, Lucas Black, Natalie Canerday, James Hampton, Robert Duvall, Rick Dial, Brent Briscoe",United States,"November 1, 2019",1996,R,135 min,"Dramas, Independent Movies","A man returns home after being released from a psychiatric hospital, where he'd been confined since age 12 for murdering his mother and her lover.","https://m.media-amazon.com/images/M/MV5BNGY5NWIxMjAtODBjNC00MmZhLTk1ZTAtNGRhYThlOTNjMTQwXkEyXkFqcGdeQXVyNTc1NTQxODI@._V1_UX67_CR0,0,67,98_AL_.jpg",sling blade,1996.0,R,135 min,Drama,8.0,"Karl Childers, a simple man hospitalized since his childhood murder of his mother and her lover, is released to start a new life in a small town.",84.0,Billy Bob Thornton,Billy Bob Thornton,Dwight Yoakam,J.T. Walsh,John Ritter,86838,"24,475,416"
s8069,Movie,spider-man: into the spider-verse,"Peter Ramsey, Rodney Rothman, Bob Persichetti","Shameik Moore, Jake Johnson, Hailee Steinfeld, Brian Tyree Henry, Lauren Vélez, Mahershala Ali, Lily Tomlin, Kathryn Hahn, Liev Schreiber, Kimiko Glenn, Nicolas Cage, John Mulaney",United States,"June 26, 2019",2018,PG,117 min,"Action & Adventure, Comedies","After being bitten by a radioactive spider, Brooklyn teen Miles Morales gets a crash course in web-slinging from his alternate-dimension counterparts.","https://m.media-amazon.com/images/M/MV5BMjMwNDkxMTgzOF5BMl5BanBnXkFtZTgwNTkwNTQ3NjM@._V1_UX67_CR0,0,67,98_AL_.jpg",spider-man: into the spider-verse,2018.0,U,117 min,"Animation, Action, Adventure",8.4,"Teen Miles Morales becomes the Spider-Man of his universe, and must join with five spider-powered individuals from other dimensions to stop a threat for all realities.",87.0,Bob Persichetti,Peter Ramsey,Rodney Rothman,Shameik Moore,Jake Johnson,375110,"190,241,310"
s8072,Movie,spotlight,Tom McCarthy,"Mark Ruffalo, Michael Keaton, Rachel McAdams, Liev Schreiber, John Slattery, Brian d'Arcy James, Stanley Tucci, Billy Crudup, Paul Guilfoyle, Jamey Sheridan",United States,"July 22, 2020",2015,R,129 min,"Dramas, Independent Movies",A team of reporters and editors at the Boston Globe relentlessly investigate a shocking child molestation cover-up by the Catholic Church.,"https://m.media-amazon.com/images/M/MV5BMjIyOTM5OTIzNV5BMl5BanBnXkFtZTgwMDkzODE2NjE@._V1_UX67_CR0,0,67,98_AL_.jpg",spotlight,2015.0,A,129 min,"Biography, Crime, Drama",8.1,"The true story of how the Boston Globe uncovered the massive scandal of child molestation and cover-up within the local Catholic Archdiocese, shaking the entire Catholic Church to its core.",93.0,Tom McCarthy,Mark Ruffalo,Michael Keaton,Rachel McAdams,Liev Schreiber,420316,"45,055,776"
s8273,Movie,the departed,Martin Scorsese,"Leonardo DiCaprio, Matt Damon, Jack Nicholson, Mark Wahlberg, Martin Sheen, Ray Winstone, Vera Farmiga, Anthony Anderson, Alec Baldwin, Kevin Corrigan","United States, Hong Kong","January 1, 2021",2006,R,151 min,"Dramas, Thrillers",Two rookie Boston cops are sent deep undercover – one inside the gang of a charismatic Irish mob boss and the other double-crossing his own department.,"https://m.media-amazon.com/images/M/MV5BMTI1MTY2OTIxNV5BMl5BanBnXkFtZTYwNjQ4NjY3._V1_UX67_CR0,0,67,98_AL_.jpg",the departed,2006.0,A,151 min,"Crime, Drama, Thriller",8.5,An undercover cop and a mole in the police attempt to identify each other while infiltrating an Irish gang in South Boston.,85.0,Martin Scorsese,Leonardo DiCaprio,Matt Damon,Jack Nicholson,Mark Wahlberg,1189773,"132,384,315"
s8297,Movie,the fighter,David O. Russell,"Mark Wahlberg, Christian Bale, Amy Adams, Melissa Leo, Jack McGee, Melissa McMeekin, Bianca Hunter, Erica McDermott, Dendrie Taylor, Jill Quigg, Kate B. O'Brien, Sugar Ray Leonard",United States,"January 13, 2019",2010,R,116 min,"Dramas, Sports Movies","After a string of defeats, a boxer rediscovers his fighting will with help from his trainer and half-brother, a once-talented pugilist.","https://m.media-amazon.com/images/M/MV5BMTM0ODk3MjM1MV5BMl5BanBnXkFtZTcwNzc1MDIwNA@@._V1_UX67_CR0,0,67,98_AL_.jpg",the fighter,2010.0,UA,116 min,"Biography, Drama, Sport",7.8,"Based on the story of Micky Ward, a fledgling boxer who tries to escape the shadow of his more famous but troubled older boxing brother and get his own shot at greatness.",79.0,David O. Russell,Mark Wahlberg,Christian Bale,Amy Adams,Melissa Leo,340584,"93,617,009"
s8321,Movie,the girl with the dragon tattoo,David Fincher,"Daniel Craig, Rooney Mara, Christopher Plummer, Stellan Skarsgård, Steven Berkoff, Robin Wright, Yorick van Wageningen, Joely Richardson, Geraldine James, Goran Visnjic","United States, Sweden, Norway","January 5, 2021",2011,R,158 min,"Dramas, Thrillers","When a young computer hacker is tasked with investigating a prying journalist, their separate missions become entangled amid a decades-old conspiracy.","https://m.media-amazon.com/images/M/MV5BMTczNDk4NTQ0OV5BMl5BanBnXkFtZTcwNDAxMDgxNw@@._V1_UX67_CR0,0,67,98_AL_.jpg",the girl with the dragon tattoo,2011.0,R,158 min,"Crime, Drama, Mystery",7.8,"Journalist Mikael Blomkvist is aided in his search for a woman who has been missing for forty years by Lisbeth Salander, a young computer hacker.",71.0,David Fincher,Daniel Craig,Rooney Mara,Christopher Plummer,Stellan Skarsgård,423010,"102,515,793"
s8342,Movie,the help,Tate Taylor,"Emma Stone, Viola Davis, Bryce Dallas Howard, Octavia Spencer, Jessica Chastain, Ahna O'Reilly, Allison Janney, Anna Camp, Cicely Tyson, Mike Vogel, Sissy Spacek, Mary Steenburgen, Carol Sutton, Dana Ivey, Amy Beckwith, Aunjanue Ellis, Kelsey Scott, Lauren Miller, Tarra Riggs, Wes Chatham, Ashley Johnson, Roslyn Ruff, Brian Kerwin, Shane McRae, Chris Lowell, Charles Cooper, Leslie Jordan, La Chanze, Elizabeth Smith, Nelsan Ellis, Ritchie Montgomery, Ted Welch, David Oyelowo, Tiffany Brouwer",United States,"June 1, 2020",2011,PG-13,147 min,Dramas,"A young, white writer stirs up the status quo in 1960s Mississippi by interviewing Black housemaids and bringing their stories to the masses.","https://m.media-amazon.com/images/M/MV5BMTM5OTMyMjIxOV5BMl5BanBnXkFtZTcwNzU4MjIwNQ@@._V1_UX67_CR0,0,67,98_AL_.jpg",the help,2011.0,UA,146 min,Drama,8.0,"An aspiring author during the civil rights movement of the 1960s decides to write a book detailing the African American maids' point of view on the white families for which they work, and the hardships they go through on a daily basis.",62.0,Tate Taylor,Emma Stone,Viola Davis,Octavia Spencer,Bryce Dallas Howard,428521,"169,708,112"
s8378,Movie,the king's speech,Tom Hooper,"Colin Firth, Geoffrey Rush, Helena Bonham Carter, Guy Pearce, Timothy Spall, Derek Jacobi, Jennifer Ehle, Anthony Andrews, Claire Bloom, Eve Best, Michael Gambon","United Kingdom, United States, Australia","June 2, 2018",2010,R,118 min,"Dramas, International Movies","In this biographical drama, Britain's King George VI struggles with an embarrassing stutter until he seeks help from speech therapist Lionel Logue.","https://m.media-amazon.com/images/M/MV5BMzU5MjEwMTg2Nl5BMl5BanBnXkFtZTcwNzM3MTYxNA@@._V1_UY98_CR0,0,67,98_AL_.jpg",the king's speech,2010.0,U,118 min,"Biography, Drama, History",8.0,"The story of King George VI, his impromptu ascension to the throne of the British Empire in 1936, and the speech therapist who helped the unsure monarch overcome his stammer.",88.0,Tom Hooper,Colin Firth,Geoffrey Rush,Helena Bonham Carter,Derek Jacobi,639603,"138,797,449"
s8397,Movie,the lives of others,Florian Henckel von Donnersmarck,"Ulrich Mühe, Martina Gedeck, Sebastian Koch, Ulrich Tukur, Thomas Thieme, Hans-Uwe Bauer, Volkmar Kleinert, Matthias Brenner, Charly Hübner",Germany,"March 15, 2019",2006,R,138 min,"Dramas, International Movies, Thrillers","As a secret police agent eavesdrops on a successful writer in East Germany in 1984, he becomes increasingly fascinated by the man's life and politics.","https://m.media-amazon.com/images/M/MV5BOThkM2EzYmMtNDE3NS00NjlhLTg4YzktYTdhNzgyOWY3ZDYzXkEyXkFqcGdeQXVyNzQzNzQxNzI@._V1_UY98_CR1,0,67,98_AL_.jpg",the lives of others,2006.0,A,137 min,"Drama, Mystery, Thriller",8.4,"In 1984 East Berlin, an agent of the secret police, conducting surveillance on a writer and his lover, finds himself becoming increasingly absorbed by their lives.",89.0,Florian Henckel von Donnersmarck,Ulrich Mühe,Martina Gedeck,Sebastian Koch,Ulrich Tukur,358685,"11,286,112"
s8405,Movie,the lord of the rings: the return of the king,Peter Jackson,"Elijah Wood, Ian McKellen, Liv Tyler, Viggo Mortensen, Sean Astin, Cate Blanchett, John Rhys-Davies, Bernard Hill, Billy Boyd, Dominic Monaghan, Orlando Bloom, Hugo Weaving","New Zealand, United States","January 1, 2020",2003,PG-13,201 min,"Action & Adventure, Sci-Fi & Fantasy","Aragorn is revealed as the heir to the ancient kings as he, Gandalf and the other members of the broken fellowship struggle to save Gondor.","https://m.media-amazon.com/images/M/MV5BNzA5ZDNlZWMtM2NhNS00NDJjLTk4NDItYTRmY2EwMWZlMTY3XkEyXkFqcGdeQXVyNzkwMjQ5NzM@._V1_UX67_CR0,0,67,98_AL_.jpg",the lord of the rings: the return of the king,2003.0,U,201 min,"Action, Adventure, Drama",8.9,Gandalf and Aragorn lead the World of Men against Sauron's army to draw his gaze from Frodo and Sam as they approach Mount Doom with the One Ring.,94.0,Peter Jackson,Elijah Wood,Viggo Mortensen,Ian McKellen,Orlando Bloom,1642758,"377,845,905"
s8406,Movie,the lord of the rings: the two towers,Peter Jackson,"Elijah Wood, Ian McKellen, Liv Tyler, Viggo Mortensen, Sean Astin, Cate Blanchett, John Rhys-Davies, Bernard Hill, Christopher Lee, Billy Boyd, Dominic Monaghan, Orlando Bloom","New Zealand, United States","January 1, 2020",2002,PG-13,179 min,"Action & Adventure, Sci-Fi & Fantasy","Frodo and Sam head to Mordor to destroy the One Ring of Power while Gimli, Legolas and Aragorn search for the orc-captured Merry and Pippin.","https://m.media-amazon.com/images/M/MV5BZGMxZTdjZmYtMmE2Ni00ZTdkLWI5NTgtNjlmMjBiNzU2MmI5XkEyXkFqcGdeQXVyNjU0OTQ0OTY@._V1_UX67_CR0,0,67,98_AL_.jpg",the lord of the rings: the two towers,2002.0,UA,179 min,"Action, Adventure, Drama",8.7,"While Frodo and Sam edge closer to Mordor with the help of the shifty Gollum, the divided fellowship makes a stand against Sauron's new ally, Saruman, and his hordes of Isengard.",87.0,Peter Jackson,Elijah Wood,Ian McKellen,Viggo Mortensen,Orlando Bloom,1485555,"342,551,365"
s8415,Movie,the matrix,"Lilly Wachowski, Lana Wachowski","Keanu Reeves, Laurence Fishburne, Carrie-Anne Moss, Hugo Weaving, Gloria Foster, Joe Pantoliano, Marcus Chong, Julian Arahanga, Matt Doran, Belinda McClory",United States,"November 1, 2019",1999,R,136 min,"Action & Adventure, Sci-Fi & Fantasy","A computer hacker learns that what most people perceive as reality is actually a simulation created by machines, and joins a rebellion to break free.","https://m.media-amazon.com/images/M/MV5BNzQzOTk3OTAtNDQ0Zi00ZTVkLWI0MTEtMDllZjNkYzNjNTc4L2ltYWdlXkEyXkFqcGdeQXVyNjU0OTQ0OTY@._V1_UX67_CR0,0,67,98_AL_.jpg",the matrix,1999.0,A,136 min,"Action, Sci-Fi",8.7,"When a beautiful stranger leads computer hacker Neo to a forbidding underworld, he discovers the shocking truth--the life he knows is the elaborate deception of an evil cyber-intelligence.",73.0,Lana Wachowski,Lilly Wachowski,Keanu Reeves,Laurence Fishburne,Carrie-Anne Moss,1676426,"171,479,930"
s8435,Movie,the naked gun: from the files of police squad!,David Zucker,"Leslie Nielsen, Priscilla Presley, George Kennedy, Ricardo Montalban, O.J. Simpson, Raye Birk, Susan Beaubian, Nancy Marchand",United States,"January 1, 2021",1988,PG-13,85 min,"Comedies, Cult Movies",Hapless cop Frank Drebin causes more problems than he solves while trying to stop a deadly plot involving Queen Elizabeth II.,"https://m.media-amazon.com/images/M/MV5BODk1ZWM4ZjItMjFhZi00MDMxLTgxNmYtODFhNWZlZTkwM2UwXkEyXkFqcGdeQXVyMTQxNzMzNDI@._V1_UX67_CR0,0,67,98_AL_.jpg",the naked gun: from the files of police squad!,1988.0,U,85 min,"Comedy, Crime",7.6,Incompetent police Detective Frank Drebin must foil an attempt to assassinate Queen Elizabeth II.,76.0,David Zucker,Leslie Nielsen,Priscilla Presley,O.J. Simpson,Ricardo Montalban,152871,"78,756,177"
s8452,Movie,the perks of being a wallflower,Stephen Chbosky,"Logan Lerman, Emma Watson, Ezra Miller, Mae Whitman, Paul Rudd, Nina Dobrev, Johnny Simmons, Dylan McDermott, Kate Walsh, Joan Cusack, Melanie Lynskey",United States,"April 1, 2020",2012,PG-13,103 min,"Comedies, Dramas",A shy freshman struggling with depression deals with his best friend's suicide and his first love in this engaging coming-of-age tale.,"https://m.media-amazon.com/images/M/MV5BZThjMmQ5YjktMTUyMC00MjljLWJmMTAtOWIzNDIzY2VhNzQ0XkEyXkFqcGdeQXVyMTAyNjg4NjE0._V1_UX67_CR0,0,67,98_AL_.jpg",the perks of being a wallflower,2012.0,UA,103 min,"Drama, Romance",8.0,An introvert freshman is taken under the wings of two seniors who welcome him to the real world,67.0,Stephen Chbosky,Logan Lerman,Emma Watson,Ezra Miller,Paul Rudd,462252,"17,738,570"
s8470,Movie,the pursuit of happyness,Gabriele Muccino,"Will Smith, Jaden Smith, Thandie Newton, Brian Howe, James Karen, Dan Castellaneta, Kurt Fuller, Takayo Fischer",United States,"October 1, 2019",2006,PG-13,117 min,Dramas,"When Chris and his son are evicted, they face trying times as a desperate Chris accepts an unpaid internship at a stock brokerage firm.","https://m.media-amazon.com/images/M/MV5BMTQ5NjQ0NDI3NF5BMl5BanBnXkFtZTcwNDI0MjEzMw@@._V1_UX67_CR0,0,67,98_AL_.jpg",the pursuit of happyness,2006.0,U,117 min,"Biography, Drama",8.0,A struggling salesman takes custody of his son as he's poised to begin a life-changing professional career.,64.0,Gabriele Muccino,Will Smith,Thandie Newton,Jaden Smith,Brian Howe,448930,"163,566,459"
s8512,Movie,the social network,David Fincher,"Jesse Eisenberg, Andrew Garfield, Justin Timberlake, Armie Hammer, Max Minghella, Josh Pence, Brenda Song, Rashida Jones, John Getz, David Selby",United States,"April 1, 2020",2010,PG-13,121 min,Dramas,Director David Fincher's biographical drama chronicles the meteoric rise of Facebook CEO Mark Zuckerberg from Harvard sophomore to Internet superstar.,"https://m.media-amazon.com/images/M/MV5BOGUyZDUxZjEtMmIzMC00MzlmLTg4MGItZWJmMzBhZjE0Mjc1XkEyXkFqcGdeQXVyMTMxODk2OTU@._V1_UX67_CR0,0,67,98_AL_.jpg",the social network,2010.0,UA,120 min,"Biography, Drama",7.7,"As Harvard student Mark Zuckerberg creates the social networking site that would become known as Facebook, he is sued by the twins who claimed he stole their idea, and by the co-founder who was later squeezed out of the business.",95.0,David Fincher,Jesse Eisenberg,Andrew Garfield,Justin Timberlake,Rooney Mara,624982,"96,962,694"
s8581,Movie,thor: ragnarok,Taika Waititi,"Chris Hemsworth, Tom Hiddleston, Cate Blanchett, Idris Elba, Jeff Goldblum, Tessa Thompson, Karl Urban, Mark Ruffalo, Anthony Hopkins, Benedict Cumberbatch, Taika Waititi, Rachel House, Clancy Brown, Tadanobu Asano, Ray Stevenson, Zachary Levi, Luke Hemsworth, Sam Neill",United States,"June 5, 2018",2017,PG-13,131 min,"Action & Adventure, Comedies, Sci-Fi & Fantasy","To save Asgard from a bloodthirsty goddess of death, the mighty Thor will have to battle his way to freedom and find a way back home.","https://m.media-amazon.com/images/M/MV5BMjMyNDkzMzI1OF5BMl5BanBnXkFtZTgwODcxODg5MjI@._V1_UX67_CR0,0,67,98_AL_.jpg",thor: ragnarok,2017.0,UA,130 min,"Action, Adventure, Comedy",7.9,"Imprisoned on the planet Sakaar, Thor must race against time to return to Asgard and stop Ragnarök, the destruction of his world, at the hands of the powerful and ruthless villain Hela.",74.0,Taika Waititi,Chris Hemsworth,Tom Hiddleston,Cate Blanchett,Mark Ruffalo,587775,"315,058,289"
s8615,Movie,trainspotting,Danny Boyle,"Ewan McGregor, Ewen Bremner, Jonny Lee Miller, Kevin McKidd, Robert Carlyle, Kelly Macdonald, Peter Mullan, James Cosmo, Eileen Nicholas, Susan Vidler, Pauline Lynch, Shirley Henderson",United Kingdom,"October 1, 2019",1996,R,94 min,"Comedies, Cult Movies, Dramas","Renton and his mates cope with the gritty realities of heroin addiction. But when Renton gets clean, he can't get away from his friends' nasty habits.","https://m.media-amazon.com/images/M/MV5BMzA5Zjc3ZTMtMmU5YS00YTMwLWI4MWUtYTU0YTVmNjVmODZhXkEyXkFqcGdeQXVyNjU0OTQ0OTY@._V1_UX67_CR0,0,67,98_AL_.jpg",trainspotting,1996.0,A,93 min,Drama,8.1,"Renton, deeply immersed in the Edinburgh drug scene, tries to clean up and get out, despite the allure of the drugs and influence of friends.",83.0,Danny Boyle,Ewan McGregor,Ewen Bremner,Jonny Lee Miller,Kevin McKidd,634716,"16,501,785"
s8669,Movie,v for vendetta,James McTeigue,"Natalie Portman, Hugo Weaving, Stephen Rea, Stephen Fry, John Hurt, Tim Pigott-Smith, Rupert Graves, Roger Allam, Ben Miles, Sinéad Cusack, Natasha Wightman","United States, United Kingdom, Germany","October 1, 2018",2005,R,132 min,"Action & Adventure, Dramas, Sci-Fi & Fantasy","A masked freedom fighter known as ""V"" takes up arms against a totalitarian government and finds an unlikely ally in a young woman.","https://m.media-amazon.com/images/M/MV5BOTI5ODc3NzExNV5BMl5BanBnXkFtZTcwNzYxNzQzMw@@._V1_UX67_CR0,0,67,98_AL_.jpg",v for vendetta,2005.0,A,132 min,"Action, Drama, Sci-Fi",8.2,"In a future British tyranny, a shadowy freedom fighter, known only by the alias of ""V"", plots to overthrow it with the help of a young woman.",62.0,James McTeigue,Hugo Weaving,Natalie Portman,Rupert Graves,Stephen Rea,1032749,"70,511,035"
s8746,Movie,willy wonka & the chocolate factory,Mel Stuart,"Gene Wilder, Jack Albertson, Peter Ostrum, Roy Kinnear, Julie Dawn Cole, Leonard Stone, Denise Nickerson, Dodo Denney, Paris Themmen, Ursula Reit","United States, East Germany, West Germany","January 1, 2020",1971,G,100 min,"Children & Family Movies, Classic Movies, Comedies",Zany Willy Wonka causes a stir when he announces that golden tickets hidden inside his candy bars will admit holders into his secret confectionary.,"https://m.media-amazon.com/images/M/MV5BZTllNDU0ZTItYTYxMC00OTI4LThlNDAtZjNiNzdhMWZiYjNmXkEyXkFqcGdeQXVyNzY1NDgwNjQ@._V1_UX67_CR0,0,67,98_AL_.jpg",willy wonka & the chocolate factory,1971.0,U,100 min,"Family, Fantasy, Musical",7.8,A poor but hopeful boy seeks one of the five coveted golden tickets that will send him on a tour of Willy Wonka's mysterious chocolate factory.,67.0,Mel Stuart,Gene Wilder,Jack Albertson,Peter Ostrum,Roy Kinnear,178731,"4,000,000"
s8769,Movie,y tu mamá también,Alfonso Cuarón,"Maribel Verdú, Gael García Bernal, Diego Luna, Daniel Giménez Cacho, Ana López Mercado, Nathan Grinberg, Verónica Langer, María Aura, Giselle Audirac, Arturo Ríos, Andrés Almeida, Diana Bracho, Emilio Echevarría",Mexico,"June 1, 2017",2001,R,106 min,"Dramas, Independent Movies, International Movies","When rich teens Tenoch and Julio meet the alluring, older Luisa, they try to impress her with stories of a road trip, then convince her to join them.","https://m.media-amazon.com/images/M/MV5BNDhjMzc3ZTgtY2Y4MC00Y2U3LWFiMDctZGM3MmM4N2YzNDQ5XkEyXkFqcGdeQXVyMTQxNzMzNDI@._V1_UX67_CR0,0,67,98_AL_.jpg",y tu mamá también,2001.0,A,106 min,Drama,7.6,"In Mexico, two teenage boys and an attractive older woman embark on a road trip and learn a thing or two about life, friendship, sex, and each other.",88.0,Alfonso Cuarón,Maribel Verdú,Gael García Bernal,Daniel Giménez Cacho,Ana López Mercado,115827,"13,622,333"
s8803,Movie,zodiac,David Fincher,"Mark Ruffalo, Jake Gyllenhaal, Robert Downey Jr., Anthony Edwards, Brian Cox, Elias Koteas, Donal Logue, John Carroll Lynch, Dermot Mulroney, Chloë Sevigny",United States,"November 20, 2019",2007,R,158 min,"Cult Movies, Dramas, Thrillers","A political cartoonist, a crime reporter and a pair of cops investigate San Francisco's infamous Zodiac Killer in this thriller based on a true story.","https://m.media-amazon.com/images/M/MV5BN2UwNDc5NmEtNjVjZS00OTI5LWE5YjctMWM3ZjBiZGYwMGI2XkEyXkFqcGdeQXVyNzkwMjQ5NzM@._V1_UX67_CR0,0,67,98_AL_.jpg",zodiac,2007.0,UA,157 min,"Crime, Drama, Mystery",7.7,"In the late 1960s/early 1970s, a San Francisco cartoonist becomes an amateur detective obsessed with tracking down the Zodiac Killer, an unidentified individual who terrorizes Northern California with a killing spree.",78.0,David Fincher,Jake Gyllenhaal,Robert Downey Jr.,Mark Ruffalo,Anthony Edwards,466080,"33,080,084"
