show_id,type,title,director,cast,country,date_added,release_year,rating,duration,listed_in,description,Poster_Link,Series_Title,Released_Year,Certificate,Runtime,Genre,IMDB_Rating,Overview,Meta_score,Director,Star1,Star2,Star3,Star4,No_of_Votes,Gross
s42,Movie,jaws,Steven Spielberg,"Roy Scheider, Robert Shaw, Richard Dreyfuss, Lorraine Gary, Murray Hamilton, Carl Gottlieb, Jeffrey Kramer, Susan Backlinie, Jonathan Filley, Ted Grossman",United States,"September 16, 2021",1975,PG,124 min,"Action & Adventure, Classic Movies, Dramas","When an insatiable great white shark terrorizes Amity Island, a police chief, an oceanographer and a grizzled shark hunter seek to destroy the beast.","https://m.media-amazon.com/images/M/MV5BMmVmODY1MzEtYTMwZC00MzNhLWFkNDMtZjAwM2EwODUxZTA5XkEyXkFqcGdeQXVyNTAyODkwOQ@@._V1_UX67_CR0,0,67,98_AL_.jpg",jaws,1975.0,A,124 min,"Adventure, Thriller",8.0,"When a killer shark unleashes chaos on a beach community, it's up to a local sheriff, a marine biologist, and an old seafarer to hunt the beast down.",87.0,Steven Spielberg,Roy Scheider,Robert Shaw,Richard Dreyfuss,Lorraine Gary,543388,"260,000,000"
s49,Movie,training day,Antoine Fuqua,"Denzel Washington, Ethan Hawke, Scott Glenn, Tom Berenger, Harris Yulin, Raymond J. Barry, Cliff Curtis, Dr. Dre, Snoop Dogg, Macy Gray, Eva Mendes",United States,"September 16, 2021",2001,R,122 min,"Dramas, Thrillers",A rookie cop with one day to prove himself to a veteran LAPD narcotics officer receives a crash course in his mentor's questionable brand of justice.,"https://m.media-amazon.com/images/M/MV5BMDZkMTUxYWEtMDY5NS00ZTA5LTg3MTItNTlkZWE1YWRjYjMwL2ltYWdlL2ltYWdlXkEyXkFqcGdeQXVyMTQxNzMzNDI@._V1_UX67_CR0,0,67,98_AL_.jpg",training day,2001.0,A,122 min,"Crime, Drama, Thriller",7.7,A rookie cop spends his first day as a Los Angeles narcotics officer with a rogue detective who isn't what he appears to be.,69.0,Antoine Fuqua,Denzel Washington,Ethan Hawke,Scott Glenn,Tom Berenger,390247,"76,631,907"
s140,Movie,do the right thing,Spike Lee,"Danny Aiello, Ossie Davis, Ruby Dee, Richard Edson, Giancarlo Esposito, Spike Lee, Bill Nunn, John Turturro, Paul Benjamin, Frankie Faison, Samuel L. Jackson, Rosie Perez, Martin Lawrence, Miguel Sandoval",United States,"September 1, 2021",1989,R,120 min,"Classic Movies, Comedies, Dramas","On a sweltering day in Brooklyn, simmering racial tensions between residents rise to the surface and ignite rage, violence and tragedy.","https://m.media-amazon.com/images/M/MV5BODA2MjU1NTI1MV5BMl5BanBnXkFtZTgwOTU4ODIwMjE@._V1_UX67_CR0,0,67,98_AL_.jpg",do the right thing,1989.0,R,120 min,"Comedy, Drama",8.0,"On the hottest day of the year on a street in the Bedford-Stuyvesant section of Brooklyn, everyone's hate and bigotry smolders and builds until it explodes into violence.",93.0,Spike Lee,Danny Aiello,Ossie Davis,Ruby Dee,Richard Edson,89429,"27,545,445"
s167,Movie,once upon a time in america,Sergio Leone,"Robert De Niro, James Woods, Elizabeth McGovern, Treat Williams, Tuesday Weld, Burt Young, Joe Pesci, Danny Aiello, William Forsythe, James Hayden","Italy, United States","September 1, 2021",1984,R,229 min,"Classic Movies, Dramas",Director Sergio Leone's sprawling crime epic follows a group of Jewish mobsters who rise in the ranks of organized crime in 1920s New York City.,"https://m.media-amazon.com/images/M/MV5BMGFkNWI4MTMtNGQ0OC00MWVmLTk3MTktOGYxN2Y2YWVkZWE2XkEyXkFqcGdeQXVyNjU0OTQ0OTY@._V1_UX67_CR0,0,67,98_AL_.jpg",once upon a time in america,1984.0,A,229 min,"Crime, Drama",8.4,"A former Prohibition-era Jewish gangster returns to the Lower East Side of Manhattan over thirty years later, where he once again must confront the ghosts and regrets of his old life.",,Sergio Leone,Robert De Niro,James Woods,Elizabeth McGovern,Treat Williams,311365,"5,321,508"
s192,Movie,wind river,Taylor Sheridan,"Jeremy Renner, Elizabeth Olsen, Jon Bernthal, Gil Birmingham, Kelsey Asbille, Tantoo Cardinal, Teo Briones, Matthew Del Negro, Hugh Dillon, Julia Jones, James Jordan, Eric Lange, Martin Sensmeier, Mason Davis, Graham Greene","United Kingdom, Canada, United States","August 28, 2021",2017,R,107 min,"Dramas, Independent Movies",A tracker with the U.S. Fish and Wildlife Service assists a rookie FBI agent who's investigating a teen girl's murder on a remote Wyoming reservation.,"https://m.media-amazon.com/images/M/MV5BMTUyMjU1OTUwM15BMl5BanBnXkFtZTgwMDg1NDQ2MjI@._V1_UX67_CR0,0,67,98_AL_.jpg",wind river,2017.0,R,107 min,"Crime, Drama, Mystery",7.7,A veteran hunter helps an FBI agent investigate the murder of a young woman on a Wyoming Native American reservation.,73.0,Taylor Sheridan,Kelsey Asbille,Jeremy Renner,Julia Jones,Teo Briones,205444,"33,800,859"
s330,Movie,catch me if you can,Steven Spielberg,"Leonardo DiCaprio, Tom Hanks, Christopher Walken, Martin Sheen, Nathalie Baye, Amy Adams, James Brolin, Brian Howe, Frank John Hughes, Steve Eastin","United States, Canada","August 1, 2021",2002,PG-13,142 min,Dramas,"An FBI agent makes it his mission to put cunning con man Frank Abagnale Jr. behind bars. But Frank not only eludes capture, he revels in the pursuit.","https://m.media-amazon.com/images/M/MV5BMTY5MzYzNjc5NV5BMl5BanBnXkFtZTYwNTUyNTc2._V1_UX67_CR0,0,67,98_AL_.jpg",catch me if you can,2002.0,A,141 min,"Biography, Crime, Drama",8.1,"Barely 21 yet, Frank is a skilled forger who has passed as a doctor, lawyer and pilot. FBI agent Carl becomes obsessed with tracking down the con man, who only revels in the pursuit.",75.0,Steven Spielberg,Leonardo DiCaprio,Tom Hanks,Christopher Walken,Martin Sheen,832846,"164,615,351"
s334,Movie,ferris bueller's day off,John Hughes,"Matthew Broderick, Alan Ruck, Mia Sara, Jeffrey Jones, Jennifer Grey, Cindy Pickett, Lyman Ward, Edie McClurg, Charlie Sheen, Kristy Swanson, Ben Stein, Del Close",United States,"August 1, 2021",1986,PG-13,103 min,"Classic Movies, Comedies, Cult Movies","After faking an illness to skip school, popular teen Ferris Bueller enjoys a fun-filled day in Chicago with his girlfriend and his uptight best friend.","https://m.media-amazon.com/images/M/MV5BMDA0NjZhZWUtNmI2NC00MmFjLTgwZDYtYzVjZmNhMDVmOTBkXkEyXkFqcGdeQXVyMTQxNzMzNDI@._V1_UX67_CR0,0,67,98_AL_.jpg",ferris bueller's day off,1986.0,U,103 min,Comedy,7.8,"A high school wise guy is determined to have a day off from school, despite what the Principal thinks of that.",61.0,John Hughes,Matthew Broderick,Alan Ruck,Mia Sara,Jeffrey Jones,321382,"70,136,369"
s341,Movie,inception,Christopher Nolan,"Leonardo DiCaprio, Joseph Gordon-Levitt, Elliot Page, Tom Hardy, Ken Watanabe, Dileep Rao, Cillian Murphy, Tom Berenger, Marion Cotillard, Pete Postlethwaite, Michael Caine, Lukas Haas","United States, United Kingdom","August 1, 2021",2010,PG-13,148 min,"Action & Adventure, Sci-Fi & Fantasy, Thrillers",A troubled thief who extracts secrets from people's dreams takes one last job: leading a dangerous mission to plant an idea in a target's subconscious.,"https://m.media-amazon.com/images/M/MV5BMjAxMzY3NjcxNF5BMl5BanBnXkFtZTcwNTI5OTM0Mw@@._V1_UX67_CR0,0,67,98_AL_.jpg",inception,2010.0,UA,148 min,"Action, Adventure, Sci-Fi",8.8,A thief who steals corporate secrets through the use of dream-sharing technology is given the inverse task of planting an idea into the mind of a C.E.O.,74.0,Christopher Nolan,Leonardo DiCaprio,Joseph Gordon-Levitt,Elliot Page,Ken Watanabe,2067042,"292,576,195"
s342,Movie,magnolia,Paul Thomas Anderson,"John C. Reilly, Philip Baker Hall, Tom Cruise, Julianne Moore, Philip Seymour Hoffman, William H. Macy, Jeremy Blackman, Jason Robards, Melinda Dillon, April Grace, Luis Guzmán, Ricky Jay, Alfred Molina, Michael Murphy, Melora Walters",United States,"August 1, 2021",1999,R,189 min,"Dramas, Independent Movies","Through chance, history and divine intervention, a cast of eclectic characters weaves and warps through each other's lives on a random day in California.","https://m.media-amazon.com/images/M/MV5BZjk3YThkNDktNjZjMS00MTBiLTllNTAtYzkzMTU0N2QwYjJjXkEyXkFqcGdeQXVyMTMxODk2OTU@._V1_UX67_CR0,0,67,98_AL_.jpg",magnolia,1999.0,R,188 min,Drama,8.0,"An epic mosaic of interrelated characters in search of love, forgiveness, and meaning in the San Fernando Valley.",77.0,Paul Thomas Anderson,Tom Cruise,Jason Robards,Julianne Moore,Philip Seymour Hoffman,289742,"22,455,976"
s358,Movie,the machinist,Brad Anderson,"Christian Bale, Jennifer Jason Leigh, Aitana Sánchez-Gijón, John Sharian, Michael Ironside, Lawrence Gilliard Jr., Reg E. Cathey, Anna Massey, Matthew Romero, Robert Long, Colin Stinton, Craig Stevenson","Spain, France, United Kingdom, United States","August 1, 2021",2004,R,102 min,"Dramas, Independent Movies, Thrillers","Haunted and gaunt after a prolonged bout of insomnia, factory worker Trevor Reznik begins to question his sanity amid a series of mysterious events.","https://m.media-amazon.com/images/M/MV5BNjk1NzBlY2YtNjJmNi00YTVmLWI2OTgtNDUxNDE5NjUzZmE0XkEyXkFqcGdeQXVyNTc1NTQxODI@._V1_UX67_CR0,0,67,98_AL_.jpg",the machinist,2004.0,R,101 min,"Drama, Thriller",7.7,An industrial worker who hasn't slept in a year begins to doubt his own sanity.,61.0,Brad Anderson,Christian Bale,Jennifer Jason Leigh,Aitana Sánchez-Gijón,John Sharian,358432,"1,082,715"
s393,Movie,django unchained,Quentin Tarantino,"Jamie Foxx, Christoph Waltz, Leonardo DiCaprio, Kerry Washington, Samuel L. Jackson, Walton Goggins, Dennis Christopher, James Remar, David Steen, Dana Gourrier, Nichole Galicia, Laura Cayouette, Ato Essandoh, Sammi Rotibi, Escalante Lundy, Don Johnson",United States,"July 24, 2021",2012,R,165 min,"Action & Adventure, Dramas","Accompanied by a German bounty hunter, a freed slave named Django travels across America to free his wife from a sadistic plantation owner.","https://m.media-amazon.com/images/M/MV5BMjIyNTQ5NjQ1OV5BMl5BanBnXkFtZTcwODg1MDU4OA@@._V1_UX67_CR0,0,67,98_AL_.jpg",django unchained,2012.0,A,165 min,"Drama, Western",8.4,"With the help of a German bounty hunter, a freed slave sets out to rescue his wife from a brutal Mississippi plantation owner.",81.0,Quentin Tarantino,Jamie Foxx,Christoph Waltz,Leonardo DiCaprio,Kerry Washington,1357682,"162,805,434"
s565,Movie,boogie nights,Paul Thomas Anderson,"Mark Wahlberg, Burt Reynolds, Julianne Moore, Heather Graham, William H. Macy, Don Cheadle, Philip Seymour Hoffman, Luis Guzmán, John C. Reilly, Philip Baker Hall",United States,"July 1, 2021",1997,R,155 min,"Comedies, Dramas, Independent Movies",A well-endowed busboy is taken in by a tight-knit group of 1970s porn actors and transforms himself into skin flick celebrity Dirk Diggler.,"https://m.media-amazon.com/images/M/MV5BY2E2YWYxY2QtZmJmZi00MjJlLWFiYWItZTk5Y2IyMWQ1ZThhXkEyXkFqcGdeQXVyMTMxODk2OTU@._V1_UX67_CR0,0,67,98_AL_.jpg",boogie nights,1997.0,R,155 min,Drama,7.9,"Back when sex was safe, pleasure was a business and business was booming, an idealistic porn producer aspires to elevate his craft to an art when he discovers a hot young talent.",85.0,Paul Thomas Anderson,Mark Wahlberg,Julianne Moore,Burt Reynolds,Luis Guzmán,239473,"26,400,640"
s592,Movie,seven pounds,Gabriele Muccino,"Will Smith, Rosario Dawson, Woody Harrelson, Michael Ealy, Barry Pepper, Elpidia Carrillo, Robinne Lee, Joe Nunez, Bill Smitrovich, Tim Kelleher, Gina Hecht, Andy Milder, Judyann Elder, Sarah Jane Morris",United States,"July 1, 2021",2008,PG-13,123 min,"Dramas, Romantic Movies","Weighed down by a dark secret, IRS agent Ben Thomas tries to improve the lives of seven strangers in need of a second chance.","https://m.media-amazon.com/images/M/MV5BMTU0NzY0MTY5OF5BMl5BanBnXkFtZTcwODY3MDEwMg@@._V1_UY98_CR3,0,67,98_AL_.jpg",seven pounds,2008.0,UA,123 min,Drama,7.6,A man with a fateful secret embarks on an extraordinary journey of redemption by forever changing the lives of seven strangers.,36.0,Gabriele Muccino,Will Smith,Rosario Dawson,Woody Harrelson,Michael Ealy,286770,"69,951,824"
s595,Movie,star trek,J.J. Abrams,"Chris Pine, Zachary Quinto, Karl Urban, Zoe Saldana, Simon Pegg, John Cho, Anton Yelchin, Eric Bana, Leonard Nimoy, Bruce Greenwood, Ben Cross, Winona Ryder","United States, Germany","July 1, 2021",2009,PG-13,128 min,"Action & Adventure, Sci-Fi & Fantasy","On their first voyage aboard the starship Enterprise, cocky rebel James T. Kirk and logic-driven Vulcan Spock try to defeat a vengeful Romulan commander.","https://m.media-amazon.com/images/M/MV5BMjE5NDQ5OTE4Ml5BMl5BanBnXkFtZTcwOTE3NDIzMw@@._V1_UX67_CR0,0,67,98_AL_.jpg",star trek,2009.0,UA,127 min,"Action, Adventure, Sci-Fi",7.9,The brash James T. Kirk tries to live up to his father's legacy with Mr. Spock keeping him in check as a vengeful Romulan from the future creates black holes to destroy the Federation one planet at a time.,82.0,J.J. Abrams,Chris Pine,Zachary Quinto,Simon Pegg,Leonard Nimoy,577336,"257,730,019"
s601,Movie,the game,David Fincher,"Michael Douglas, Sean Penn, Deborah Kara Unger, James Rebhorn, Peter Donat, Carroll Baker, Anna Katarina, Armin Mueller-Stahl",United States,"July 1, 2021",1997,R,129 min,Thrillers,An aloof investment banker's life spirals into peril and paranoia after his brother gives him an odd birthday gift: the chance to play a mysterious game.,"https://m.media-amazon.com/images/M/MV5BZGVmMDNmYmEtNGQ2Mi00Y2ZhLThhZTYtYjE5YmQzMjZiZGMxXkEyXkFqcGdeQXVyNDk3NzU2MTQ@._V1_UY98_CR1,0,67,98_AL_.jpg",the game,1997.0,UA,129 min,"Action, Drama, Mystery",7.8,"After a wealthy banker is given an opportunity to participate in a mysterious game, his life is turned upside down when he becomes unable to distinguish between the game and reality.",61.0,David Fincher,Michael Douglas,Deborah Kara Unger,Sean Penn,James Rebhorn,345096,"48,323,648"
s703,Movie,silver linings playbook,David O. Russell,"Bradley Cooper, Jennifer Lawrence, Robert De Niro, Jacki Weaver, Chris Tucker, Anupam Kher, John Ortiz, Shea Whigham, Julia Stiles, Paul Herman",United States,"June 17, 2021",2012,R,122 min,"Comedies, Dramas, Independent Movies","A man with bipolar disorder moves home with his parents and makes a connection with a spirited widow, which helps both of them heal in unique ways.","https://m.media-amazon.com/images/M/MV5BMTM2MTI5NzA3MF5BMl5BanBnXkFtZTcwODExNTc0OA@@._V1_UX67_CR0,0,67,98_AL_.jpg",silver linings playbook,2012.0,A,122 min,"Comedy, Drama, Romance",7.7,"After a stint in a mental institution, former teacher Pat Solitano moves back in with his parents and tries to reconcile with his ex-wife. Things get more challenging when Pat meets Tiffany, a mysterious girl with problems of her own.",81.0,David O. Russell,Bradley Cooper,Jennifer Lawrence,Robert De Niro,Jacki Weaver,661871,"132,092,958"
s793,Movie,flipped,Rob Reiner,"Madeline Carroll, Callan McAuliffe, Rebecca De Mornay, Anthony Edwards, John Mahoney, Penelope Ann Miller, Aidan Quinn, Kevin Weisman, Morgan Lily, Ryan Ketzner",United States,"June 2, 2021",2010,PG,90 min,"Comedies, Dramas, Romantic Movies","Bryce and Juli first meet as children, with Juli having a crush on Bryce. As they mature, it appears their bond may blossom into something more.","https://m.media-amazon.com/images/M/MV5BMTU2NjQ1Nzc4MF5BMl5BanBnXkFtZTcwNTM0NDk1Mw@@._V1_UX67_CR0,0,67,98_AL_.jpg",flipped,2010.0,PG,90 min,"Comedy, Drama, Romance",7.7,Two eighth-graders start to have feelings for each other despite being total opposites.,45.0,Rob Reiner,Madeline Carroll,Callan McAuliffe,Rebecca De Mornay,Anthony Edwards,81446,"1,752,214"
s798,Movie,i am sam,Jessie Nelson,"Sean Penn, Michelle Pfeiffer, Dakota Fanning, Dianne Wiest, Loretta Devine, Richard Schiff, Laura Dern, Brad Silverman, Joseph Rosenberg, Stanley DeSantis, Doug Hutchison",United States,"June 2, 2021",2001,PG-13,132 min,Dramas,"When the legal system declares him unfit to be a parent, a father with an intellectual disability fights to regain custody of his young daughter.","https://m.media-amazon.com/images/M/MV5BYzEyNzc0NjctZjJiZC00MWI1LWJlOTMtYWZkZDAzNzQ0ZDNkXkEyXkFqcGdeQXVyMTQxNzMzNDI@._V1_UX67_CR0,0,67,98_AL_.jpg",i am sam,2001.0,PG-13,132 min,Drama,7.7,A mentally handicapped man fights for custody of his 7-year-old daughter and in the process teaches his cold-hearted lawyer the value of love and family.,28.0,Jessie Nelson,Sean Penn,Michelle Pfeiffer,Dakota Fanning,Dianne Wiest,142863,"40,311,852"
s800,Movie,million dollar baby,Clint Eastwood,"Clint Eastwood, Hilary Swank, Morgan Freeman, Anthony Mackie, Jay Baruchel, Mike Colter, Lucia Rijker, Brían F. O'Byrne, Margo Martindale, Riki Lindhome",United States,"June 2, 2021",2004,PG-13,133 min,"Dramas, Sports Movies","When a cantankerous trainer mentors a persistent amateur boxer determined to go pro, deep-seated emotions become their strongest opponents.","https://m.media-amazon.com/images/M/MV5BMTkxNzA1NDQxOV5BMl5BanBnXkFtZTcwNTkyMTIzMw@@._V1_UX67_CR0,0,67,98_AL_.jpg",million dollar baby,2004.0,UA,132 min,"Drama, Sport",8.1,A determined woman works with a hardened boxing trainer to become a professional.,86.0,Clint Eastwood,Hilary Swank,Clint Eastwood,Morgan Freeman,Jay Baruchel,635975,"100,492,203"
s820,Movie,the outlaw josey wales,Clint Eastwood,"Clint Eastwood, Sondra Locke, Chief Dan George, Bill McKinney, John Vernon, Paula Trueman, Sam Bottoms, Geraldine Keams, Woodrow Parfrey, Joyce Jameson",United States,"June 2, 2021",1976,PG,136 min,"Action & Adventure, Classic Movies","In this gritty Oscar-nominated Western, an ex-Confederate soldier on the run comes to rest in a quiet community, where he falls for a pretty settler.","https://m.media-amazon.com/images/M/MV5BMjIxNDYxMTk2MF5BMl5BanBnXkFtZTgwMjQxNjU3MTE@._V1_UY98_CR0,0,67,98_AL_.jpg",the outlaw josey wales,1976.0,A,135 min,Western,7.8,Missouri farmer Josey Wales joins a Confederate guerrilla unit and winds up on the run from the Union soldiers who murdered his family.,69.0,Clint Eastwood,Clint Eastwood,Sondra Locke,Chief Dan George,Bill McKinney,65659,"31,800,000"
s934,Movie,hachi: a dog's tale,Lasse Hallström,"Richard Gere, Joan Allen, Cary-Hiroyuki Tagawa, Sarah Roemer, Jason Alexander, Erick Avari, Davenia McFadden, Robbie Sublett, Kevin DeCoste, Rob Degnan","United Kingdom, United States","May 1, 2021",2009,G,93 min,"Children & Family Movies, Dramas","When his master dies, a loyal pooch named Hachiko keeps a vigil for more than a decade at the train station where he once greeted his owner every day.","https://m.media-amazon.com/images/M/MV5BNzE4NDg5OWMtMzg3NC00ZDRjLTllMDMtZTRjNWZmNjBmMGZlXkEyXkFqcGdeQXVyMTMxODk2OTU@._V1_UY98_CR1,0,67,98_AL_.jpg",hachi: a dog's tale,2009.0,G,93 min,"Biography, Drama, Family",8.1,A college professor bonds with an abandoned dog he takes into his home.,,Lasse Hallström,Richard Gere,Joan Allen,Cary-Hiroyuki Tagawa,Sarah Roemer,253575,
s943,Movie,mystic river,Clint Eastwood,"Sean Penn, Tim Robbins, Kevin Bacon, Laurence Fishburne, Marcia Gay Harden, Laura Linney, Kevin Chapman, Tom Guiry, Emmy Rossum, Spencer Treat Clark","United States, Australia","May 1, 2021",2003,R,138 min,"Dramas, Thrillers","Haunted by a monstrous crime, three childhood friends in Boston cross paths again decades later in connection with a murder investigation.","https://m.media-amazon.com/images/M/MV5BMTIzNDUyMjA4MV5BMl5BanBnXkFtZTYwNDc4ODM3._V1_UX67_CR0,0,67,98_AL_.jpg",mystic river,2003.0,A,138 min,"Crime, Drama, Mystery",7.9,The lives of three men who were childhood friends are shattered when one of them has a family tragedy.,84.0,Clint Eastwood,Sean Penn,Tim Robbins,Kevin Bacon,Emmy Rossum,419420,"90,135,191"
s996,Movie,vizontele,"Yılmaz Erdoğan, Ömer Faruk Sorak","Yılmaz Erdoğan, Demet Akbağ, Altan Erkekli, Cem Yılmaz, Cezmi Baskın, Bican Günalan, Sebnem Sönmez, İclal Aydın, Mesut Çakarli, Zeynep Tokuş",Turkey,"April 23, 2021",2001,TV-MA,106 min,"Comedies, Dramas, International Movies","In 1974, a rural town in Anatolia gets its first television set – an event that's met with both excitement and trepidation by the villagers.","https://m.media-amazon.com/images/M/MV5BMjA2MzM4NjkyMF5BMl5BanBnXkFtZTYwMTQ2ODc5._V1_UY98_CR2,0,67,98_AL_.jpg",vizontele,2001.0,,110 min,"Comedy, Drama",8.0,Lives of residents in a small Anatolian village change when television is introduced to them,,Yilmaz Erdogan,Ömer Faruk Sorak,Yilmaz Erdogan,Demet Akbag,Altan Erkekli,33592,
s1023,Movie,taare zameen par,Aamir Khan,"Aamir Khan, Darsheel Safary, Tanay Chheda, Tisca Chopra, Vipin Sharma, Girija Oak, M.K. Raina",India,"April 17, 2021",2007,PG,162 min,"Dramas, International Movies","When daydreamer Ishaan is sent to boarding school, an unconventional art teacher tries to help the imaginative student discover his true identity.","https://m.media-amazon.com/images/M/MV5BMDhjZWViN2MtNzgxOS00NmI4LThiZDQtZDI3MzM4MDE4NTc0XkEyXkFqcGdeQXVyMTMxODk2OTU@._V1_UY98_CR1,0,67,98_AL_.jpg",taare zameen par,2007.0,U,165 min,"Drama, Family",8.4,"An eight-year-old boy is thought to be a lazy trouble-maker, until the new art teacher has the patience and compassion to discover the real problem behind his struggles in school.",,Aamir Khan,Amole Gupte,Darsheel Safary,Aamir Khan,Tisca Chopra,168895,"1,223,869"
s1034,Movie,rush,Ron Howard,"Chris Hemsworth, Daniel Brühl, Olivia Wilde, Alexandra Maria Lara, Pierfrancesco Favino, David Calder, Natalie Dormer, Stephen Mangan, Christian McKay, Alistair Petrie","United Kingdom, Germany, United States","April 16, 2021",2013,R,123 min,"Action & Adventure, Dramas, International Movies","In the 1970s, a rivalry propels race car drivers Niki Lauda and James Hunt to fame and glory — until a horrible accident threatens to end it all.","https://m.media-amazon.com/images/M/MV5BOWEwODJmZDItYTNmZC00OGM4LThlNDktOTQzZjIzMGQxODA4XkEyXkFqcGdeQXVyNjU0OTQ0OTY@._V1_UX67_CR0,0,67,98_AL_.jpg",rush,2013.0,UA,123 min,"Action, Biography, Drama",8.1,The merciless 1970s rivalry between Formula One rivals James Hunt and Niki Lauda.,74.0,Ron Howard,Daniel Brühl,Chris Hemsworth,Olivia Wilde,Alexandra Maria Lara,432811,"26,947,624"
s1115,Movie,3 idiots,Rajkumar Hirani,"Aamir Khan, Kareena Kapoor, Madhavan, Sharman Joshi, Omi Vaidya, Boman Irani, Mona Singh, Javed Jaffrey",India,"April 1, 2021",2009,PG-13,164 min,"Comedies, Dramas, International Movies","While attending one of India's premier colleges, three miserable engineering students and best friends struggle to beat the school's draconian system.","https://m.media-amazon.com/images/M/MV5BNTkyOGVjMGEtNmQzZi00NzFlLTlhOWQtODYyMDc2ZGJmYzFhXkEyXkFqcGdeQXVyNjU0OTQ0OTY@._V1_UY98_CR0,0,67,98_AL_.jpg",3 idiots,2009.0,UA,170 min,"Comedy, Drama",8.4,"Two friends are searching for their long lost companion. They revisit their college days and recall the memories of their friend who inspired them to think differently, even as the rest of the world called them ""idiots"".",67.0,Rajkumar Hirani,Aamir Khan,Madhavan,Mona Singh,Sharman Joshi,344445,"6,532,908"
s1127,Movie,my fair lady,George Cukor,"Audrey Hepburn, Rex Harrison, Stanley Holloway, Wilfred Hyde-White, Gladys Cooper, Jeremy Brett, Theodore Bikel, Mona Washbourne, Isobel Elsom, John Holland, Alan Napier, Marni Nixon",United States,"April 1, 2021",1964,G,173 min,"Classic Movies, Music & Musicals","When a Cockney flower girl takes elocution lessons from an aloof professor, he decides to introduce her to high society, transforming both their lives.","https://m.media-amazon.com/images/M/MV5BNGM0ZTU3NmItZmRmMy00YWNjLWEzMWItYzg3MzcwZmM5NjdiXkEyXkFqcGdeQXVyNDYyMDk5MTU@._V1_UY98_CR2,0,67,98_AL_.jpg",my fair lady,1964.0,U,170 min,"Drama, Family, Musical",7.8,Snobbish phonetics Professor Henry Higgins agrees to a wager that he can make flower girl Eliza Doolittle presentable in high society.,95.0,George Cukor,Audrey Hepburn,Rex Harrison,Stanley Holloway,Wilfrid Hyde-White,86525,"72,000,000"
s1139,Movie,the pianist,Roman Polański,"Adrien Brody, Thomas Kretschmann, Frank Finlay, Maureen Lipman, Emilia Fox, Ed Stoppard, Julia Rayner, Jessica Kate Meyer, Ronan Vibert, Ruth Platt","United Kingdom, France, Poland, Germany, United States","April 1, 2021",2002,R,149 min,"Dramas, Independent Movies, International Movies",Famed Polish pianist Wladyslaw Szpilman struggles to survive the onslaught of Nazi tyranny during World War II in this drama based on his memoirs.,"https://m.media-amazon.com/images/M/MV5BOWRiZDIxZjktMTA1NC00MDQ2LWEzMjUtMTliZmY3NjQ3ODJiXkEyXkFqcGdeQXVyNjU0OTQ0OTY@._V1_UY98_CR2,0,67,98_AL_.jpg",the pianist,2002.0,R,150 min,"Biography, Drama, Music",8.5,A Polish Jewish musician struggles to survive the destruction of the Warsaw ghetto of World War II.,85.0,Roman Polanski,Adrien Brody,Thomas Kretschmann,Frank Finlay,Emilia Fox,729603,"32,572,577"
s1176,Movie,philomena,Stephen Frears,"Judi Dench, Steve Coogan, Sophie Kennedy Clark, Mare Winningham, Barbara Jefford, Ruth McCabe, Peter Hermann, Sean Mahon, Anna Maxwell Martin, Michelle Fairley, Kate Fleetwood","United Kingdom, United States, France","March 22, 2021",2013,PG-13,98 min,"Dramas, Independent Movies, International Movies",A kind-hearted Irishwoman teams with an acerbic journalist to find the son she was forced to give up for adoption 50 years ago.,"https://m.media-amazon.com/images/M/MV5BMjA5ODgyNzcxMV5BMl5BanBnXkFtZTgwMzkzOTYzMDE@._V1_UX67_CR0,0,67,98_AL_.jpg",philomena,2013.0,PG-13,98 min,"Biography, Comedy, Drama",7.6,"A world-weary political journalist picks up the story of a woman's search for her son, who was taken away from her decades ago after she became pregnant and was forced to live in a convent.",77.0,Stephen Frears,Judi Dench,Steve Coogan,Sophie Kennedy Clark,Mare Winningham,94212,"37,707,719"
