show_id,type,title,director,cast,country,date_added,release_year,rating,duration,listed_in,description,Poster_Link,Series_Title,Released_Year,Certificate,Runtime,Genre,IMDB_Rating,Overview,Meta_score,Director,Star1,Star2,Star3,Star4,No_of_Votes,Gross
s1252,Movie,dances with wolves,Kevin Costner,"Kevin Costner, Mary McDonnell, Rodney Grant, Graham Greene, Floyd ""Red Crow"" Westerman, Tantoo Cardinal, Robert Pastorelli, Charles Rocket, Maury Chaykin, Jimmy Herman","United States, United Kingdom","March 1, 2021",1990,PG-13,181 min,"Action & Adventure, Classic Movies, Dramas","On the frontier, a Civil War soldier bonds with a Sioux tribe and adapts to their way of life, becoming their ally amid growing threats.","https://m.media-amazon.com/images/M/MV5BMTY3OTI5NDczN15BMl5BanBnXkFtZTcwNDA0NDY3Mw@@._V1_UX67_CR0,0,67,98_AL_.jpg",dances with wolves,1990.0,U,181 min,"Adventure, Drama, Western",8.0,"Lieutenant John Dunbar, assigned to a remote western Civil War outpost, befriends wolves and Indians, making him an intolerable aberration in the military.",72.0,Kevin Costner,Kevin Costner,Mary McDonnell,Graham Greene,Rodney A. Grant,240266,"184,208,848"
s1255,Movie,rain man,Barry Levinson,"Dustin Hoffman, Tom Cruise, Valeria Golino, Gerald R. Molen, Jack Murdock, Michael D. Roberts, Ralph Seymour, Lucinda Jenney, Bonnie Hunt",United States,"March 1, 2021",1988,R,134 min,"Classic Movies, Dramas","Motivated by money, a selfish workaholic seeking a piece of his late father's inheritance takes a life-changing road trip with his estranged brother.","https://m.media-amazon.com/images/M/MV5BMzVjNzI4NzYtMjE4NS00M2IzLWFkOWMtOTYwMWUzN2ZlNGVjL2ltYWdlL2ltYWdlXkEyXkFqcGdeQXVyMTQxNzMzNDI@._V1_UX67_CR0,0,67,98_AL_.jpg",rain man,1988.0,U,133 min,Drama,8.0,Selfish yuppie Charlie Babbitt's father left a fortune to his savant brother Raymond and a pittance to Charlie; they travel cross-country.,65.0,Barry Levinson,Dustin Hoffman,Tom Cruise,Valeria Golino,Gerald R. Molen,473064,"178,800,000"
s1260,Movie,captain fantastic,Matt Ross,"Viggo Mortensen, Frank Langella, George MacKay, Samantha Isler, Annalise Basso, Nicholas Hamilton, Shree Crooks, Charlie Shotwell, Ann Dowd, Erin Moriarty, Missi Pyle, Kathryn Hahn, Steve Zahn",United States,"February 26, 2021",2016,R,119 min,"Comedies, Dramas, Independent Movies","A father raising his children off the grid begins to question his anti-establishment, utopian views when a tragic loss pulls them back into society.","https://m.media-amazon.com/images/M/MV5BMjE5OTM0OTY5NF5BMl5BanBnXkFtZTgwMDcxOTQ3ODE@._V1_UX67_CR0,0,67,98_AL_.jpg",captain fantastic,2016.0,R,118 min,"Comedy, Drama",7.9,"In the forests of the Pacific Northwest, a father devoted to raising his six kids with a rigorous physical and intellectual education is forced to leave his paradise and enter the world, challenging his idea of what it means to be a parent.",72.0,Matt Ross,Viggo Mortensen,George MacKay,Samantha Isler,Annalise Basso,189400,"5,875,006"
s1359,Movie,shutter island,Martin Scorsese,"Leonardo DiCaprio, Mark Ruffalo, Ben Kingsley, Max von Sydow, Michelle Williams, Emily Mortimer, Patricia Clarkson, Jackie Earle Haley, Ted Levine, John Carroll Lynch, Elias Koteas",United States,"February 1, 2021",2010,R,139 min,Thrillers,A U.S. marshal's troubling visions compromise his investigation into the disappearance of a patient from a hospital for the criminally insane.,"https://m.media-amazon.com/images/M/MV5BYzhiNDkyNzktNTZmYS00ZTBkLTk2MDAtM2U0YjU1MzgxZjgzXkEyXkFqcGdeQXVyMTMxODk2OTU@._V1_UX67_CR0,0,67,98_AL_.jpg",shutter island,2010.0,A,138 min,"Mystery, Thriller",8.2,"In 1954, a U.S. Marshal investigates the disappearance of a murderer who escaped from a hospital for the criminally insane.",63.0,Martin Scorsese,Leonardo DiCaprio,Emily Mortimer,Mark Ruffalo,Ben Kingsley,1129894,"128,012,934"
s1422,Movie,the intouchables,"Olivier Nakache, Éric Toledano","François Cluzet, Omar Sy, Anne Le Ny, Audrey Fleurot, Joséphine de Meaux, Clotilde Mollet, Alba Gaïa Kraghede Bellugi, Cyril Mendy",France,"January 11, 2021",2011,R,112 min,"Comedies, Dramas, International Movies","In need of a caregiver, a wealthy aristocrat with quadriplegia hires the last person anyone expects: an ex-con with no experience. Based on a true story.","https://m.media-amazon.com/images/M/MV5BMTYxNDA3MDQwNl5BMl5BanBnXkFtZTcwNTU4Mzc1Nw@@._V1_UX67_CR0,0,67,98_AL_.jpg",the intouchables,2011.0,UA,112 min,"Biography, Comedy, Drama",8.5,"After he becomes a quadriplegic from a paragliding accident, an aristocrat hires a young man from the projects to be his caregiver.",57.0,Olivier Nakache,Éric Toledano,François Cluzet,Omar Sy,Anne Le Ny,760360,"13,182,281"
s1457,Movie,into the wild,Sean Penn,"Emile Hirsch, Marcia Gay Harden, William Hurt, Jena Malone, Brian Dierker, Catherine Keener, Vince Vaughn, Kristen Stewart, Hal Holbrook, Zach Galifianakis",United States,"January 1, 2021",2007,R,148 min,"Action & Adventure, Dramas, Independent Movies",A young man gives up everything – including his trust fund and ties to a seemingly stable family – to lead a solitary life in the wild.,"https://m.media-amazon.com/images/M/MV5BMTAwNDEyODU1MjheQTJeQWpwZ15BbWU2MDc3NDQwNw@@._V1_UX67_CR0,0,67,98_AL_.jpg",into the wild,2007.0,R,148 min,"Adventure, Biography, Drama",8.1,"After graduating from Emory University, top student and athlete Christopher McCandless abandons his possessions, gives his entire $24,000 savings account to charity and hitchhikes to Alaska to live in the wilderness. Along the way, Christopher encounters a series of characters that shape his life.",73.0,Sean Penn,Emile Hirsch,Vince Vaughn,Catherine Keener,Marcia Gay Harden,572921,"18,354,356"
s1470,Movie,what's eating gilbert grape,Lasse Hallström,"Johnny Depp, Leonardo DiCaprio, Juliette Lewis, Mary Steenburgen, Darlene Cates, Laura Harrington, Mary Kate Schellhardt, Kevin Tighe, John C. Reilly, Crispin Glover",United States,"January 1, 2021",1993,PG-13,118 min,"Classic Movies, Dramas, Independent Movies","In a backwater Iowa town, young Gilbert is torn between taking care of his troubled family and a girl who shows him new possibilities for his life.","https://m.media-amazon.com/images/M/MV5BY2EyZDlhNjItODYzNi00Mzc3LWJjOWUtMTViODU5MTExZWMyL2ltYWdlXkEyXkFqcGdeQXVyMTQxNzMzNDI@._V1_UX67_CR0,0,67,98_AL_.jpg",what's eating gilbert grape,1993.0,U,118 min,Drama,7.8,A young man in a small Midwestern town struggles to care for his mentally-disabled younger brother and morbidly obese mother while attempting to pursue his own happiness.,73.0,Lasse Hallström,Johnny Depp,Leonardo DiCaprio,Juliette Lewis,Mary Steenburgen,215034,"9,170,214"
s1843,Movie,the trial of the chicago 7,Aaron Sorkin,"Sacha Baron Cohen, Eddie Redmayne, Yahya Abdul-Mateen II, Jeremy Strong, Mark Rylance, Joseph Gordon-Levitt, Michael Keaton, Frank Langella, John Carroll Lynch, Alex Sharp, John Doman, Ben Shenkman","United States, United Kingdom, India","October 16, 2020",2020,R,130 min,Dramas,What was supposed to be a peaceful protest turned into a violent clash with the police. What followed was one of the most notorious trials in history.,"https://m.media-amazon.com/images/M/MV5BYjYzOGE1MjUtODgyMy00ZDAxLTljYTgtNzk0Njg2YWQwMTZhXkEyXkFqcGdeQXVyMDM2NDM2MQ@@._V1_UX67_CR0,0,67,98_AL_.jpg",the trial of the chicago 7,2020.0,R,129 min,"Drama, History, Thriller",7.8,"The story of 7 people on trial stemming from various charges surrounding the uprising at the 1968 Democratic National Convention in Chicago, Illinois.",77.0,Aaron Sorkin,Eddie Redmayne,Alex Sharp,Sacha Baron Cohen,Jeremy Strong,89896,
s1913,Movie,hunt for the wilderpeople,Taika Waititi,"Sam Neill, Julian Dennison, Rima Te Wiata, Rachel House, Tioreore Ngatai-Melbourne, Oscar Kightley, Stan Walker, Mike Minogue, Cohen Holloway, Rhys Darby",New Zealand,"October 1, 2020",2016,PG-13,101 min,"Action & Adventure, Comedies, Dramas",A misadventure in the wilderness leads to life-changing discoveries for a troubled orphan teen from the city and his belligerent foster father.,"https://m.media-amazon.com/images/M/MV5BMjI1MDQ2MDg5Ml5BMl5BanBnXkFtZTgwMjc2NjM5ODE@._V1_UX67_CR0,0,67,98_AL_.jpg",hunt for the wilderpeople,2016.0,UA,101 min,"Adventure, Comedy, Drama",7.9,A national manhunt is ordered for a rebellious kid and his foster uncle who go missing in the wild New Zealand bush.,81.0,Taika Waititi,Sam Neill,Julian Dennison,Rima Te Wiata,Rachel House,111483,"5,202,582"
s1944,Movie,jab we met,Imtiaz Ali,"Shahid Kapoor, Kareena Kapoor, Tarun Arora, Dara Singh, Pavan Malhotra, Kamal Tiwari, Kiran Juneja, Divya Seth, Saumya Tandon",India,"September 28, 2020",2007,TV-14,143 min,"Comedies, International Movies, Music & Musicals",Changing fortunes await a wealthy but dejected industrialist when he meets a spirited chatterbox on a train in this breezy Bollywood romantic comedy.,"https://m.media-amazon.com/images/M/MV5BYmIzYmY4MGItM2I4YS00OWZhLWFmMzQtYzI2MWY1MmM3NGU1XkEyXkFqcGdeQXVyNjQ2MjQ5NzM@._V1_UY98_CR0,0,67,98_AL_.jpg",jab we met,2007.0,U,138 min,"Comedy, Drama, Romance",7.9,A depressed wealthy businessman finds his life changing after he meets a spunky and care-free young woman.,,Imtiaz Ali,Shahid Kapoor,Kareena Kapoor,Tarun Arora,Dara Singh,47720,"410,800"
s2011,Movie,how to train your dragon 2,Dean DeBlois,"Jay Baruchel, Cate Blanchett, Gerard Butler, Craig Ferguson, America Ferrera, Jonah Hill, Christopher Mintz-Plasse, T.J. Miller, Kristen Wiig, Djimon Hounsou, Kit Harington",United States,"September 11, 2020",2014,PG,102 min,Children & Family Movies,"Hiccup, Toothless and a mysterious dragon rider join forces to protect the island of Berk from a power-hungry warrior with a dragon army of his own.","https://m.media-amazon.com/images/M/MV5BMzMwMTAwODczN15BMl5BanBnXkFtZTgwMDk2NDA4MTE@._V1_UX67_CR0,0,67,98_AL_.jpg",how to train your dragon 2,2014.0,U,102 min,"Animation, Action, Adventure",7.8,"When Hiccup and Toothless discover an ice cave that is home to hundreds of new wild dragons and the mysterious Dragon Rider, the two friends find themselves at the center of a battle to protect the peace.",76.0,Dean DeBlois,Jay Baruchel,Cate Blanchett,Gerard Butler,Craig Ferguson,305611,"177,002,924"
s2273,Movie,drishyam,Nishikant Kamat,"Ajay Devgn, Shriya Saran, Tabu, Rajat Kapoor, Ishita Dutta, Mrunal Jadhav, Prasanna Ketkar, Yogesh Sonam, Prathamesh Parab, Rishabh Chaddha",India,"July 5, 2020",2015,TV-14,162 min,"Dramas, International Movies, Thrillers",An unexceptional man becomes a murder suspect when the son of a high-ranking police official who harassed his daughter goes missing.,"https://m.media-amazon.com/images/M/MV5BYmJhZmJlYTItZmZlNy00MGY0LTg0ZGMtNWFkYWU5NTA1YTNhXkEyXkFqcGdeQXVyODE5NzE3OTE@._V1_UY98_CR0,0,67,98_AL_.jpg",drishyam,2015.0,UA,163 min,"Crime, Drama, Mystery",8.2,"Desperate measures are taken by a man who tries to save his family from the dark side of the law, after they commit an unexpected crime.",,Nishikant Kamat,Ajay Devgn,Shriya Saran,Tabu,Rajat Kapoor,70367,"739,478"
s2315,Movie,stardust,Matthew Vaughn,"Claire Danes, Michelle Pfeiffer, Robert De Niro, Charlie Cox, Sienna Miller, Ricky Gervais, Jason Flemyng, Rupert Everett, Peter O'Toole, Mark Strong, Kate Magowan, Ian McKellen","United Kingdom, United States","July 1, 2020",2007,PG-13,128 min,"Action & Adventure, International Movies, Romantic Movies","To win his true love's heart, wide-eyed Tristan Thorn journeys to a forbidden realm to retrieve a fallen star that has taken human form.","https://m.media-amazon.com/images/M/MV5BMjkyMTE1OTYwNF5BMl5BanBnXkFtZTcwMDIxODYzMw@@._V1_UX67_CR0,0,67,98_AL_.jpg",stardust,2007.0,U,127 min,"Adventure, Family, Fantasy",7.6,"In a countryside town bordering on a magical land, a young man makes a promise to his beloved that he'll retrieve a fallen star by venturing into the magical realm.",66.0,Matthew Vaughn,Charlie Cox,Claire Danes,Sienna Miller,Ian McKellen,255036,"38,634,938"
s2546,Movie,andaz apna apna,Rajkumar Santoshi,"Aamir Khan, Salman Khan, Raveena Tandon, Karisma Kapoor, Paresh Rawal, Mehmood, Deven Verma, Jagdeep, Shakti Kapoor",India,"May 11, 2020",1994,TV-14,160 min,"Action & Adventure, Comedies, Cult Movies","Broke and with no concrete plans for the future, two young men discover that a stunning heiress lives nearby and try to charm her into marriage.","https://m.media-amazon.com/images/M/MV5BZTIwYzRjMGYtZWQ0Ni00NDZhLThhZDYtOGViZGJiZTkwMzk2XkEyXkFqcGdeQXVyODE5NzE3OTE@._V1_UY98_CR3,0,67,98_AL_.jpg",andaz apna apna,1994.0,U,160 min,"Action, Comedy, Romance",8.2,Two slackers competing for the affections of an heiress inadvertently become her protectors from an evil criminal.,,Rajkumar Santoshi,Aamir Khan,Salman Khan,Raveena Tandon,Karisma Kapoor,49300,
s2635,Movie,the artist,Michel Hazanavicius,"Jean Dujardin, Bérénice Bejo, John Goodman, James Cromwell, Penelope Ann Miller, Missi Pyle, Beth Grant, Ed Lauter, Joel Murray, Elizabeth Tulloch, Ken Davitian, Malcolm McDowell","France, Belgium, United States","April 25, 2020",2011,PG-13,101 min,"Comedies, Dramas, Independent Movies","Winner of five Oscars, this black-and-white silent film follows the romance between a silent-era legend on a downward spiral and a rising starlet.","https://m.media-amazon.com/images/M/MV5BMDUyZWU5N2UtOWFlMy00MTI0LTk0ZDYtMzFhNjljODBhZDA5XkEyXkFqcGdeQXVyNzA4ODc3ODU@._V1_UY98_CR1,0,67,98_AL_.jpg",the artist,2011.0,U,100 min,"Comedy, Drama, Romance",7.9,An egomaniacal film star develops a relationship with a young dancer against the backdrop of Hollywood's silent era.,89.0,Michel Hazanavicius,Jean Dujardin,Bérénice Bejo,John Goodman,James Cromwell,230624,"44,671,682"
s2705,Movie,the florida project,Sean Baker,"Brooklynn Prince, Bria Vinaite, Willem Dafoe, Christopher Rivera, Valeria Cotto, Macon Blair, Caleb Landry Jones",United States,"April 6, 2020",2017,R,111 min,"Dramas, Independent Movies",A mischievous 6-year-old finds the magic in her own circumstances while living with her troubled mom in a budget motel near Disney World.,"https://m.media-amazon.com/images/M/MV5BMjg4ZmY1MmItMjFjOS00ZTg2LWJjNDYtNDM2YmM2NzhiNmZhXkEyXkFqcGdeQXVyNTAzMTY4MDA@._V1_UX67_CR0,0,67,98_AL_.jpg",the florida project,2017.0,A,111 min,Drama,7.6,"Set over one summer, the film follows precocious six-year-old Moonee as she courts mischief and adventure with her ragtag playmates and bonds with her rebellious but caring mother, all while living in the shadows of Walt Disney World.",92.0,Sean Baker,Brooklynn Prince,Bria Vinaite,Willem Dafoe,Christopher Rivera,95181,"5,904,366"
s2733,Movie,kal ho naa ho,Nikkhil Advani,"Shah Rukh Khan, Saif Ali Khan, Preity Zinta, Jaya Bhaduri, Sushma Seth, Reema Lagoo, Lillete Dubey, Delnaaz Paul",India,"April 1, 2020",2003,TV-14,187 min,"Comedies, Dramas, International Movies",An uptight MBA student falls for the charismatic new neighbor who charms her troubled family – but he has a secret that forces him to push her away.,"https://m.media-amazon.com/images/M/MV5BYmVjNDIxODAtNWZiZi00ZDBlLWJmOTUtNDNjMGExNTViMzE1XkEyXkFqcGdeQXVyNTE0MDc0NTM@._V1_UX67_CR0,0,67,98_AL_.jpg",kal ho naa ho,2003.0,U,186 min,"Comedy, Drama, Musical",8.0,"Naina, an introverted, perpetually depressed girl's life changes when she meets Aman. But Aman has a secret of his own which changes their lives forever. Embroiled in all this is Rohit, Naina's best friend who conceals his love for her.",54.0,Nikkhil Advani,Preity Zinta,Shah Rukh Khan,Saif Ali Khan,Jaya Bachchan,63460,"1,787,378"
s2864,Movie,there will be blood,Paul Thomas Anderson,"Daniel Day-Lewis, Paul Dano, Kevin J. O'Connor, Ciarán Hinds, Dillon Freasier, Sydney McCallister, David Willis, David Warshofsky, Colton Woodward, Russell Harvard",United States,"March 1, 2020",2007,R,158 min,"Dramas, Independent Movies","An ambitious prospector strikes it rich and turns a simple village into a boomtown, stoking the ire of a charismatic young preacher.","https://m.media-amazon.com/images/M/MV5BMjAxODQ4MDU5NV5BMl5BanBnXkFtZTcwMDU4MjU1MQ@@._V1_UX67_CR0,0,67,98_AL_.jpg",there will be blood,2007.0,A,158 min,Drama,8.2,"A story of family, religion, hatred, oil and madness, focusing on a turn-of-the-century prospector in the early days of the business.",93.0,Paul Thomas Anderson,Daniel Day-Lewis,Paul Dano,Ciarán Hinds,Martin Stringer,517359,"40,222,514"
s3069,Movie,pan's labyrinth,Guillermo del Toro,"Ivana Baquero, Sergi López, Maribel Verdú, Doug Jones, Ariadna Gil, Álex Angulo, Manolo Solo, César Vea, Roger Casamajor, Sergi Lopez","Mexico, Spain","January 1, 2020",2006,R,119 min,"Dramas, International Movies, Sci-Fi & Fantasy",Young Ofelia meets a mythical faun who claims she is destined to become princess of the Underworld. But first she must carry out three perilous tasks.,"https://m.media-amazon.com/images/M/MV5BMTU3ODg2NjQ5NF5BMl5BanBnXkFtZTcwMDEwODgzMQ@@._V1_UX67_CR0,0,67,98_AL_.jpg",pan's labyrinth,2006.0,UA,118 min,"Drama, Fantasy, War",8.2,"In the Falangist Spain of 1944, the bookish young stepdaughter of a sadistic army officer escapes into an eerie but captivating fantasy world.",98.0,Guillermo del Toro,Ivana Baquero,Ariadna Gil,Sergi López,Maribel Verdú,618623,"37,634,615"
s3132,Movie,dil chahta hai,Farhan Akhtar,"Aamir Khan, Saif Ali Khan, Akshaye Khanna, Preity Zinta, Sonali Kulkarni, Dimple Kapadia, Ayub Khan, Rajat Kapoor, Suhasini Mulay, Ahmed Khan",India,"December 15, 2019",2001,TV-14,185 min,"Comedies, Dramas, International Movies","Inseparable childhood friends Akash, Sameer and Siddharth are just out of college. Nothing comes between them – until they each fall in love.","https://m.media-amazon.com/images/M/MV5BMjRjMTYwMTYtMmRkNi00MmVkLWE0MjQtNmM3YjI0NWFhZDNmXkEyXkFqcGdeQXVyODE5NzE3OTE@._V1_UX67_CR0,0,67,98_AL_.jpg",dil chahta hai,2001.0,Unrated,183 min,"Comedy, Drama, Romance",8.1,"Three inseparable childhood friends are just out of college. Nothing comes between them - until they each fall in love, and their wildly different approaches to relationships creates tension.",,Farhan Akhtar,Aamir Khan,Saif Ali Khan,Akshaye Khanna,Preity Zinta,66803,"300,000"
s3150,Movie,zindagi na milegi dobara,Zoya Akhtar,"Hrithik Roshan, Abhay Deol, Farhan Akhtar, Katrina Kaif, Kalki Koechlin, Deepti Naval, Naseeruddin Shah, Ariadna Cabrol",India,"December 15, 2019",2011,TV-14,154 min,"Comedies, Dramas, International Movies",Three friends on an adventurous road trip/bachelor party in Spain learn some lessons about themselves and each other that will change them forever.,"https://m.media-amazon.com/images/M/MV5BZGFmMjM5OWMtZTRiNC00ODhlLThlYTItYTcyZDMyYmMyYjFjXkEyXkFqcGdeQXVyNDUzOTQ5MjY@._V1_UY98_CR0,0,67,98_AL_.jpg",zindagi na milegi dobara,2011.0,U,155 min,"Comedy, Drama",8.1,Three friends decide to turn their fantasy vacation into reality after one of their friends gets engaged.,,Zoya Akhtar,Hrithik Roshan,Farhan Akhtar,Abhay Deol,Katrina Kaif,67927,"3,108,485"
s3170,Movie,marriage story,Noah Baumbach,"Scarlett Johansson, Adam Driver, Laura Dern, Alan Alda, Ray Liotta, Julie Hagerty, Merritt Wever, Azhy Robertson","United Kingdom, United States","December 6, 2019",2019,R,137 min,Dramas,Academy Award-nominated filmmaker Noah Baumbach directs this incisive and compassionate look at a marriage coming apart and a family staying together.,"https://m.media-amazon.com/images/M/MV5BZGVmY2RjNDgtMTc3Yy00YmY0LTgwODItYzBjNWJhNTRlYjdkXkEyXkFqcGdeQXVyMjM4NTM5NDY@._V1_UX67_CR0,0,67,98_AL_.jpg",marriage story,2019.0,U,137 min,"Comedy, Drama, Romance",7.9,Noah Baumbach's incisive and compassionate look at a marriage breaking up and a family staying together.,94.0,Noah Baumbach,Adam Driver,Scarlett Johansson,Julia Greer,Azhy Robertson,246644,"2,000,000"
s3228,Movie,the irishman,Martin Scorsese,"Robert De Niro, Al Pacino, Joe Pesci, Harvey Keitel, Ray Romano, Bobby Cannavale, Anna Paquin, Stephen Graham, Stephanie Kurtzuba, Kathrine Narducci, Welker White, Jesse Plemons, Jack Huston, Domenick Lombardozzi, Louis Cancelmi, Paul Herman, Gary Basaraba, Marin Ireland, Sebastian Maniscalco, Steven Van Zandt",United States,"November 27, 2019",2019,R,209 min,Dramas,Hit man Frank Sheeran looks back at the secrets he kept as a loyal member of the Bufalino crime family in this acclaimed film from Martin Scorsese.,"https://m.media-amazon.com/images/M/MV5BMGUyM2ZiZmUtMWY0OC00NTQ4LThkOGUtNjY2NjkzMDJiMWMwXkEyXkFqcGdeQXVyMzY0MTE3NzU@._V1_UX67_CR0,0,67,98_AL_.jpg",the irishman,2019.0,R,209 min,"Biography, Crime, Drama",7.9,"An old man recalls his time painting houses for his friend, Jimmy Hoffa, through the 1950-70s.",94.0,Martin Scorsese,Robert De Niro,Al Pacino,Joe Pesci,Harvey Keitel,324720,"7,000,000"
s3274,Movie,klaus,Sergio Pablos,"Jason Schwartzman, J.K. Simmons, Rashida Jones, Will Sasso, Neda Margrethe Labba, Sergio Pablos, Norm Macdonald, Joan Cusack","Spain, United Kingdom","November 15, 2019",2019,PG,98 min,"Children & Family Movies, Comedies","A selfish postman and a reclusive toymaker form an unlikely friendship, delivering joy to a cold, dark town that desperately needs it.","https://m.media-amazon.com/images/M/MV5BMWYwOThjM2ItZGYxNy00NTQwLWFlZWEtM2MzM2Q5MmY3NDU5XkEyXkFqcGdeQXVyMTkxNjUyNQ@@._V1_UX67_CR0,0,67,98_AL_.jpg",klaus,2019.0,PG,96 min,"Animation, Adventure, Comedy",8.2,"A simple act of kindness always sparks another, even in a frozen, faraway place. When Smeerensburg's new postman, Jesper, befriends toymaker Klaus, their gifts melt an age-old feud and deliver a sleigh full of holiday traditions.",65.0,Sergio Pablos,Carlos Martínez López,Jason Schwartzman,J.K. Simmons,Rashida Jones,104761,
s3714,Movie,kahaani,Sujoy Ghosh,"Vidya Balan, Parambrata Chatterjee, Dhritiman Chatterjee, Saswata Chatterjee, Indraneil Sengupta, Nawazuddin Siddiqui, Darshan Jariwala, Masood Akhtar, Riddhi Sen",India,"June 26, 2019",2012,TV-14,122 min,"International Movies, Music & Musicals, Thrillers","Pregnant and alone in the city of Kolkata, a woman begins a relentless search for her missing husband, only to find that nothing is what it seems.","https://m.media-amazon.com/images/M/MV5BMTQ1NDI0NzkyOF5BMl5BanBnXkFtZTcwNzAyNzE2Nw@@._V1_UY98_CR0,0,67,98_AL_.jpg",kahaani,2012.0,UA,122 min,"Mystery, Thriller",8.1,"A pregnant woman's search for her missing husband takes her from London to Kolkata, but everyone she questions denies having ever met him.",,Sujoy Ghosh,Vidya Balan,Parambrata Chattopadhyay,Indraneil Sengupta,Nawazuddin Siddiqui,57806,"1,035,953"
s3909,Movie,about time,Richard Curtis,"Domhnall Gleeson, Rachel McAdams, Bill Nighy, Lydia Wilson, Lindsay Duncan, Richard Cordery, Tom Hollander, Margot Robbie, Joshua McGuire, Vanessa Kirby",United Kingdom,"April 16, 2019",2013,R,123 min,"Comedies, Dramas, International Movies","When Tim learns that the men in his family can travel in time and change their own lives, he decides to go back and win the woman of his dreams.","https://m.media-amazon.com/images/M/MV5BMTA1ODUzMDA3NzFeQTJeQWpwZ15BbWU3MDgxMTYxNTk@._V1_UX67_CR0,0,67,98_AL_.jpg",about time,2013.0,R,123 min,"Comedy, Drama, Fantasy",7.8,"At the age of 21, Tim discovers he can travel in time and change what happens and has happened in his own life. His decision to make his world a better place by getting a girlfriend turns out not to be as easy as you might think.",55.0,Richard Curtis,Domhnall Gleeson,Rachel McAdams,Bill Nighy,Lydia Wilson,303032,"15,322,921"
s4218,Movie,monty python and the holy grail,"Terry Gilliam, Terry Jones","Graham Chapman, John Cleese, Eric Idle, Terry Gilliam, Terry Jones, Michael Palin, Connie Booth, Carol Cleveland, Neil Innes",United Kingdom,"January 2, 2019",1975,PG,92 min,"Action & Adventure, Classic Movies, Comedies",The Monty Python comedy clan skewers King Arthur and his Knights of the Round Table as they quest far and wide for the Holy Grail.,"https://m.media-amazon.com/images/M/MV5BN2IyNTE4YzUtZWU0Mi00MGIwLTgyMmQtMzQ4YzQxYWNlYWE2XkEyXkFqcGdeQXVyNjU0OTQ0OTY@._V1_UX67_CR0,0,67,98_AL_.jpg",monty python and the holy grail,1975.0,PG,91 min,"Adventure, Comedy, Fantasy",8.2,"King Arthur and his Knights of the Round Table embark on a surreal, low-budget search for the Holy Grail, encountering many, very silly obstacles.",91.0,Terry Gilliam,Terry Jones,Graham Chapman,John Cleese,Eric Idle,500875,"1,229,197"
s4288,Movie,andhadhun,Sriram Raghavan,"Tabu, Ayushmann Khurrana, Radhika Apte, Anil Dhawan, Manav Vij, Zakir Hussain, Ashwini Kalsekar, Chhaya Kadam, Pawan Singh, Kabir Sajid",India,"December 16, 2018",2018,TV-14,137 min,"Comedies, Dramas, International Movies",A visually impaired pianist’s world careens into a series of shocking twists after he unintentionally lands at the murder scene of a former film star.,"https://m.media-amazon.com/images/M/MV5BZWZhMjhhZmYtOTIzOC00MGYzLWI1OGYtM2ZkN2IxNTI4ZWI3XkEyXkFqcGdeQXVyNDAzNDk0MTQ@._V1_UY98_CR0,0,67,98_AL_.jpg",andhadhun,2018.0,UA,139 min,"Crime, Drama, Music",8.3,"A series of mysterious events change the life of a blind pianist, who must now report a crime that he should technically know nothing of.",,Sriram Raghavan,Ayushmann Khurrana,Tabu,Radhika Apte,Anil Dhawan,71875,"1,373,943"
s4295,Movie,the theory of everything,James Marsh,"Emily Watson, Charlie Cox, Felicity Jones, Maxine Peake, Harry Lloyd, Eddie Redmayne, David Thewlis, Simon McBurney","United Kingdom, Japan","December 16, 2018",2014,PG-13,123 min,"Dramas, Romantic Movies","As his esteem grows in the world of physics, Stephen Hawking's body is ravaged by ALS, forcing his increasing dependence on his devoted wife, Jane.","https://m.media-amazon.com/images/M/MV5BMTAwMTU4MDA3NDNeQTJeQWpwZ15BbWU4MDk4NTMxNTIx._V1_UX67_CR0,0,67,98_AL_.jpg",the theory of everything,2014.0,U,123 min,"Biography, Drama, Romance",7.7,A look at the relationship between the famous physicist Stephen Hawking and his wife.,72.0,James Marsh,Eddie Redmayne,Felicity Jones,Tom Prior,Sophie Perry,404182,"35,893,537"
